"","SubmissionDate","starttime","endtime","tl","note_1","note_2","intro","consent_text","consent","note_3","date_time","id","gender_q2_1","age_q2_2","vht_naba","long_VHT_q2_3","unit_q2_3vht","number_q2_3vht","started_VHT_q2_4","paid_q2_5vht","earn_q2_6vht","long_naba_q2_3","unit_q2_3naba","number_q2_3naba","started_naba_q2_4","paid_q2_5naba","earn_q2_6naba","hospital_q2_7","unit_q2_7","number_q2_7","hospital_q2_7b","unit_q2_7b","number_q2_7b","households_q2_8","visits_q2_9","visits_q2_9units","visits_q2_9number","note_3_1","violence_q3_1f","other_q3_1g","other_q3_1g_number","q3_2err","note_3_3","victim_q3_3a","perpetrator_q3_3b","victim_fam_q3_3c","perpetrator_fam_q3_3d","victim_friends_q3_3e","perpetrator_friends_q3_3f","neighbors_q3_3g","other_q3_3h","other_q3_3h_number","q3_3err","viol_unreported_q3_2","viol_unreported_q3_3b","viol_nomedic_q3_5","viol_nomedic_q3_5why","advice_q3_6","years_vill_q2_12","people_known_q2_13","intervene_q8_9","friends_fam_q16_3","note_q6_1","rounds_q6_1","machete_q6_2","killed_witch_q14_1","possible_kill_q14_1b","witchdoctor_q6_4","films_q17_1","other_attend_q17_2","note_thanks","instanceID","formdef_version","KEY","tc_id"
"1","11/3/2016 19:40","11/3/2016 10:57","11/3/2016 11:22",4,NA,NA,NA,NA,1,NA,"11/3/2016 10:57","V412401",2,46,1,NA,2,4,"I was elected by the residents",2,"Farmer",NA,NA,NA,NA,NA,NA,NA,1,5,NA,1,20,25,NA,3,2,NA,0,"0",0,NA,NA,NA,NA,NA,NA,NA,NA,NA,NA,NA,NA,2,NA,2,NA,"I counsel both sides",25,2,1,1,NA,2,2,1,1,3,6,1,NA,"uuid:30cbd651-26a5-49aa-8df9-7a0999937944",1611022330,"uuid:30cbd651-26a5-49aa-8df9-7a0999937944",79
"2","11/3/2016 19:40","11/3/2016 12:01","11/3/2016 12:24",4,NA,NA,NA,NA,1,NA,"11/3/2016 12:01","V412402",2,34,1,NA,2,5,"The subcounty chief called me up for the position",2,"Owns a clinic",NA,NA,NA,NA,NA,NA,NA,1,15,NA,1,50,50,NA,2,1,NA,1,"0",0,NA,NA,1,0,0,0,0,0,0,"0",0,NA,NA,NA,1,"They fear going to report their husbands and later lose their marriages","I first ascertain the cause of the dispute and later counsel her accordingly",12,2,1,1,NA,2,2,NA,1,2,7,4,NA,"uuid:bbce5921-1e97-4685-b34e-26883da37f46",1611022330,"uuid:bbce5921-1e97-4685-b34e-26883da37f46",79
"3","11/3/2016 19:40","11/3/2016 12:54","11/3/2016 13:13",4,NA,NA,NA,NA,1,NA,"11/3/2016 12:54","V412402",1,40,1,NA,2,2011,"Was elected by village residents",2,"Carpentry",NA,NA,NA,NA,NA,NA,NA,1,40,NA,2,1.5,120,NA,3,2,NA,0,"0",0,NA,NA,NA,NA,NA,NA,NA,NA,NA,NA,NA,NA,2,NA,2,NA,"I advice her to try the law makers for counseling",40,2,1,1,NA,2,2,1,1,3,7,4,NA,"uuid:91493134-945f-46d7-bd7b-33ac969a8bca",1611022330,"uuid:91493134-945f-46d7-bd7b-33ac969a8bca",79
"4","11/3/2016 19:40","11/3/2016 14:22","11/3/2016 14:43",4,NA,NA,NA,NA,1,NA,"11/3/2016 14:23","V412404",2,47,1,NA,2,5,"I was called up by the district officials",2,"Farmer",NA,NA,NA,NA,NA,NA,NA,1,30,NA,2,1,150,NA,2,1,NA,3,"0",0,NA,NA,3,0,0,0,0,0,0,"0",0,NA,NA,NA,1,"Sometimes their husbands prohibit them doing so or else they face more trouble","I call up the couple and counsel them",47,2,1,1,NA,2,2,2,1,3,7,4,NA,"uuid:b7fc4a2b-ac4e-47e8-a504-9929a61a6a6a",1611022330,"uuid:b7fc4a2b-ac4e-47e8-a504-9929a61a6a6a",79
"5","11/3/2016 19:45","11/3/2016 14:51","11/3/2016 15:20",2,NA,NA,NA,NA,1,NA,"11/3/2016 14:52","V403464",2,38,2,NA,NA,NA,NA,NA,NA,NA,2,20,"I was first elected secretary for women then I was later appointed as the nabakyaala",2,"Farming",NA,1,10,NA,1,30,NA,NA,NA,NA,NA,25,"0",0,NA,NA,19,6,0,0,0,0,0,"0",0,NA,NA,NA,1,"Lack of money for medical expenses","I talk to the woman with her husband to find out what the source of the problem is",23,2,1,1,NA,1,2,2,2,3,NA,4,NA,"uuid:70a6b34e-baef-47e0-8a05-898141499f20",1611022330,"uuid:70a6b34e-baef-47e0-8a05-898141499f20",77
"6","11/3/2016 21:11","11/3/2016 14:47","11/3/2016 15:29",3,NA,NA,NA,NA,1,NA,"11/3/2016 14:47","V411043",1,34,1,NA,2,11,"2004",2,"Farming",NA,NA,NA,NA,NA,NA,NA,1,10,NA,2,3,150,NA,3,1,NA,3,"Poor roads",20,NA,NA,3,0,0,0,0,0,0,"0",0,NA,NA,NA,1,"Financial problems  and they also fear there husbands to be imprisoned","Advise her to report to police",34,2,1,1,NA,2,2,2,1,3,7,2,NA,"uuid:1ebe29bd-803e-4a15-865a-4ec0438c80bb",1611022330,"uuid:1ebe29bd-803e-4a15-865a-4ec0438c80bb",104
"7","11/4/2016 19:32","11/4/2016 13:28","11/4/2016 17:12",4,NA,NA,NA,NA,1,NA,"11/4/2016 13:29","V410032",2,73,2,NA,NA,NA,NA,NA,NA,NA,1,10,"Elected",2,"Farming",NA,2,1,NA,2,2,NA,NA,NA,NA,NA,4,"Cleanliness in homes",5,NA,NA,4,0,0,0,0,0,0,"0",0,NA,NA,NA,2,NA,"I find out why she was beaten then I counsel that couple",34,2,1,1,NA,2,2,1,1,2,8,NA,NA,"uuid:4fe62295-36c8-486c-99ac-cec04f0c98eb",1611022330,"uuid:4fe62295-36c8-486c-99ac-cec04f0c98eb",71
"8","11/4/2016 19:32","11/4/2016 16:15","11/4/2016 16:40",4,NA,NA,NA,NA,1,NA,"11/4/2016 16:20","V410031",2,43,1,NA,2,5,"I was elected by the residents of my village",2,"Farmer",NA,NA,NA,NA,NA,NA,NA,2,2,NA,2,1,96,NA,3,2,NA,1,"They always bring me their marriage issues concerning the husbands not giving them a financial help",4,NA,NA,1,0,0,0,0,0,0,"0",0,NA,NA,NA,1,"Sometimes they are the trouble makers","I first find out the cause of the problem and layer counsel her",11,2,1,1,NA,2,2,2,1,3,5,1,NA,"uuid:fb363978-238d-4286-b074-ec9897a482b5",1611022330,"uuid:fb363978-238d-4286-b074-ec9897a482b5",71
"9","11/4/2016 19:32","11/4/2016 16:48","11/4/2016 17:08",4,NA,NA,NA,NA,1,NA,"11/4/2016 16:48","V410033",1,26,1,NA,2,1,"The chairman invited for the training and I later qualified",2,"Farming",NA,NA,NA,NA,NA,NA,NA,1,15,NA,1,90,73,NA,2,3,NA,1,"Some people always ask me for the reports that come up after a thorough check up about the health situations done by health organizations in their area",2,NA,NA,1,0,0,0,0,0,0,"0",0,NA,NA,NA,2,NA,"I advice her to go to the chairman",25,2,1,2,NA,2,2,2,1,3,7,2,NA,"uuid:b7a3562b-d5ed-4b41-a35b-6d609838ca43",1611022330,"uuid:b7a3562b-d5ed-4b41-a35b-6d609838ca43",71
"10","11/4/2016 19:49","11/4/2016 13:24","11/4/2016 13:46",2,NA,NA,NA,NA,1,NA,"11/4/2016 13:24","V407311",2,64,1,NA,2,9,"An NGO from Masaka came to my village looking for volunteers so I volunteered",2,"Farming ",NA,NA,NA,NA,NA,NA,NA,1,10,NA,1,10,120,NA,3,2,NA,20,"0",0,NA,NA,14,6,0,0,0,0,0,"0",0,NA,NA,NA,2,NA,"I approach the man to try and find out the cause of the problem",56,1,1,1,NA,1,2,1,1,3,8,4,NA,"uuid:9d9f4241-f473-417e-9f7c-18ed94d9ebd9",1611022330,"uuid:9d9f4241-f473-417e-9f7c-18ed94d9ebd9",88
"11","11/4/2016 19:49","11/4/2016 14:05","11/4/2016 14:24",2,NA,NA,NA,NA,1,NA,"11/4/2016 14:05","V407312",1,26,1,NA,2,5,"I was selected to replace another VHT to work for an NGO",2,"Farming",NA,NA,NA,NA,NA,NA,NA,1,20,NA,1,20,200,NA,3,1,NA,0,"0",0,NA,NA,NA,NA,NA,NA,NA,NA,NA,NA,NA,NA,1,10,1,"Lack of transport to the hospital","I ask the woman what the cause of the violence is, and later I talk to the husband to get his side of the story",26,2,1,1,NA,1,2,2,1,3,7,1,NA,"uuid:18b93cc1-49e2-48ba-8624-9b78c34c22a1",1611022330,"uuid:18b93cc1-49e2-48ba-8624-9b78c34c22a1",88
"12","11/5/2016 18:59","11/5/2016 9:59","11/5/2016 12:51",3,NA,NA,NA,NA,1,NA,"11/5/2016 12:59","V416233",2,38,1,NA,2,2,"Started slowly going to the hospital then later I was appointed by the chairman",2,"Has a stall and sells clothes too in different markets and days",NA,NA,NA,NA,NA,NA,NA,1,15,NA,1,5,30,NA,3,1,NA,0,"None",0,NA,NA,NA,NA,NA,NA,NA,NA,NA,NA,NA,NA,1,3,2,NA,"I can advice her to please her husband or pray to God so that he change the situation and if it all fails she should go police",22,2,1,1,NA,1,1,2,1,3,7,4,NA,"uuid:1dd2558f-b42a-4726-9d74-93d1f2dac5a4",1611022330,"uuid:1dd2558f-b42a-4726-9d74-93d1f2dac5a4",96
"13","11/7/2016 11:29","11/7/2016 10:55","11/7/2016 11:29",3,NA,NA,NA,NA,1,NA,"11/7/2016 11:05","V416012",2,49,1,NA,2,10,"11",2,"Farming",NA,NA,NA,NA,NA,NA,NA,1,15,NA,1,30,200,NA,4,2,NA,0,"0",0,NA,NA,NA,NA,NA,NA,NA,NA,NA,NA,NA,NA,2,NA,2,NA,"I counsel them",35,2,1,1,NA,2,1,2,1,NA,7,1,NA,"uuid:9a8bd49b-80c8-4bda-a45f-b34552e44e11",1611022330,"uuid:9a8bd49b-80c8-4bda-a45f-b34552e44e11",93
"14","11/7/2016 13:26","11/7/2016 10:43","11/7/2016 11:09",4,NA,NA,NA,NA,1,NA,"11/7/2016 10:43","V416014",2,68,2,NA,NA,NA,NA,NA,NA,NA,2,14,"I was elected by the village residents",2,"Farming",NA,1,20,NA,1,30,NA,NA,NA,NA,NA,0,"Advising the young generation about how to be successful in life",3,NA,NA,NA,NA,NA,NA,NA,NA,NA,NA,NA,NA,1,1,2,NA,"I first listen to both sides of the story and then I counsel them",38,3,1,1,NA,2,2,1,1,3,7,2,NA,"uuid:f1a115d0-a89e-4f3a-b692-25f18da7fe7e",1611022330,"uuid:f1a115d0-a89e-4f3a-b692-25f18da7fe7e",93
"15","11/7/2016 13:57","11/7/2016 12:29","11/7/2016 12:40",2,NA,NA,NA,NA,1,NA,"11/7/2016 12:30","V412192",1,31,1,NA,2,6,"I was elected by the people through the chairperson",2,"Farming",NA,NA,NA,NA,NA,NA,NA,2,30,NA,1,30,600,NA,4,2,NA,3,"0",0,NA,NA,2,1,0,0,0,0,0,"0",0,NA,NA,NA,2,NA,"I talk to her husband first then offer counseling to both of them",31,2,1,1,NA,1,2,2,2,3,8,4,NA,"uuid:d5ad5090-2fca-45a0-bbfc-e6d3c9f67e4d",1611022330,"uuid:d5ad5090-2fca-45a0-bbfc-e6d3c9f67e4d",77
"16","11/7/2016 13:57","11/7/2016 13:06","11/7/2016 13:22",2,NA,NA,NA,NA,1,NA,"11/7/2016 13:07","V412194",1,29,1,NA,2,6,"I was elected by the people",2,"Farming",NA,NA,NA,NA,NA,NA,NA,1,10,NA,1,25,80,NA,4,1,NA,0,"0",0,NA,NA,NA,NA,NA,NA,NA,NA,NA,NA,NA,NA,2,NA,2,NA,"I ask her why her husband beat her then refer her to a more qualified person like a village paralegal ",29,2,1,1,NA,1,2,1,1,3,8,4,NA,"uuid:656f0627-40a4-459d-8de8-eede411c3788",1611022330,"uuid:656f0627-40a4-459d-8de8-eede411c3788",77
"17","11/7/2016 13:57","11/7/2016 12:47","11/7/2016 13:03",2,NA,NA,NA,NA,1,NA,"11/7/2016 12:47","V412193",1,39,1,NA,2,4,"I was appointed by the chairperson",2,"Farming",NA,NA,NA,NA,NA,NA,NA,1,40,NA,1,30,250,NA,3,5,NA,4,"0",0,NA,NA,4,0,0,0,0,0,0,"0",0,NA,NA,NA,2,NA,"I try to counsel the couple and show them that fighting is not the solution to their troubles",7,2,1,1,NA,1,1,2,1,3,8,4,NA,"uuid:5820d5e6-c495-451c-bbc5-c63706f43158",1611022330,"uuid:5820d5e6-c495-451c-bbc5-c63706f43158",77
"18","11/7/2016 22:57","11/7/2016 10:57","11/7/2016 12:02",3,NA,NA,NA,NA,1,NA,"11/7/2016 10:57","V417141",2,40,1,NA,2,11,"Selected by the Chairman LC1",2,"She does farming where she sales crops and earns some money ",NA,NA,NA,NA,NA,NA,NA,1,45,NA,2,2,50,NA,3,2,NA,6,"0",0,NA,NA,3,0,1,1,1,0,0,"0",0,NA,NA,NA,1,"Some women do not have money to go for medication as they depend entirely on their hasbands. So they opt to keep silent.","She just fowards the case to the LC1 chairman ",40,2,1,1,NA,1,2,1,1,3,8,4,NA,"uuid:6da5853a-a730-449e-badd-993e5766640b",1611022330,"uuid:6da5853a-a730-449e-badd-993e5766640b",111
"19","11/8/2016 7:09","11/7/2016 12:08","11/7/2016 13:07",2,NA,NA,NA,NA,1,NA,"11/7/2016 12:18","V410061",2,52,2,NA,NA,NA,NA,NA,NA,NA,2,3,"The people trusted me to be their nabakyala",2,"Am a farmer",NA,2,1,NA,2,3,NA,NA,NA,NA,NA,5,"Advising people to educate their children and solving people's case or issues",0,NA,NA,3,1,1,0,0,0,0,"O",0,NA,NA,NA,1,"Husbands lack responsibility","I call both the husband and wife,we sit together to find out why its happening and solve the situation",17,2,2,1,NA,2,1,1,2,NA,7,1,NA,"uuid:ec7f6248-2e9c-47c6-91fe-a316c36b9cbd",1611022330,"uuid:ec7f6248-2e9c-47c6-91fe-a316c36b9cbd",72
"20","11/8/2016 16:57","11/7/2016 14:17","11/7/2016 14:41",3,NA,NA,NA,NA,1,NA,"11/7/2016 14:17","V401054",1,36,1,NA,2,8,"Was selected by the council members because i used to do lots of voluntary work",2,"Farming",NA,NA,NA,NA,NA,NA,NA,1,30,NA,1,30,150,NA,1,1,NA,3,"0",0,NA,NA,2,1,0,0,0,0,0,"0",0,NA,NA,NA,2,NA,"I tell her to invite her husband for counselling , if he refuses , i ask her to report to police",36,2,1,1,NA,2,2,2,1,3,7,1,NA,"uuid:e7b04b22-a719-4e1e-9501-d663787f5001",1611022330,"uuid:e7b04b22-a719-4e1e-9501-d663787f5001",83
"21","11/8/2016 20:17","11/8/2016 10:26","11/8/2016 11:24",2,NA,NA,NA,NA,1,NA,"11/8/2016 10:28","V307264",2,46,1,NA,2,10,"I was appointed by the chairperson through an NGO to serve as a VHT",2,"She tends in a retail shop,  she is also a farmer",NA,NA,NA,NA,NA,NA,NA,1,5,NA,1,15,40,NA,3,4,NA,10,"Youths are always asking about the availability of condoms",20,NA,NA,7,3,0,0,0,0,0,"0",0,NA,NA,NA,2,NA,"I talk to her husband and tell him to stop being violent to his wife",26,2,1,1,NA,1,1,1,2,2,7,1,NA,"uuid:bb778579-ab67-4d63-a8cf-005fa5a5f147",1611022330,"uuid:bb778579-ab67-4d63-a8cf-005fa5a5f147",57
"22","11/8/2016 20:17","11/8/2016 11:24","11/8/2016 11:53",2,NA,NA,NA,NA,1,NA,"11/8/2016 11:31","V307263",2,36,1,NA,1,7,"I was elected by the people ",2,"Farming",NA,NA,NA,NA,NA,NA,NA,1,5,NA,1,30,40,NA,3,1,NA,0,"0",0,NA,NA,NA,NA,NA,NA,NA,NA,NA,NA,NA,NA,1,2,2,NA,"I ask her what she thinks is the reason for her husband's violence then base on that to find a solution",30,3,1,1,NA,1,1,1,1,2,8,4,NA,"uuid:9cd2f62f-b917-452a-9bf9-91841b6c2ea3",1611022330,"uuid:9cd2f62f-b917-452a-9bf9-91841b6c2ea3",57
"23","11/8/2016 20:17","11/8/2016 11:56","11/8/2016 12:05",2,NA,NA,NA,NA,1,NA,"11/8/2016 11:56","V307262",2,23,1,NA,1,7,"I was appointed the village people ",2,"Farming",NA,NA,NA,NA,NA,NA,NA,1,5,NA,1,10,20,NA,3,0,NA,0,"0",0,NA,NA,NA,NA,NA,NA,NA,NA,NA,NA,NA,NA,1,1,2,NA,"I ask her for the reason for her beating",5,4,1,1,NA,1,1,1,1,3,7,4,NA,"uuid:ce34dbb5-6dd8-4a12-a631-3d173237b001",1611022330,"uuid:ce34dbb5-6dd8-4a12-a631-3d173237b001",57
"24","11/8/2016 20:17","11/8/2016 17:05","11/8/2016 17:27",2,NA,NA,NA,NA,1,NA,"11/8/2016 17:05","V307261",2,56,2,NA,NA,NA,NA,NA,NA,NA,2,15,"I was elected by the people",2,"Tailoring",NA,1,10,NA,1,10,NA,NA,NA,NA,NA,6,"0",0,NA,NA,6,0,0,0,0,0,0,"0",0,NA,NA,NA,2,NA,"I talk to the husband and find out the reason behind  the violence ",36,2,1,1,NA,1,2,1,1,3,8,4,NA,"uuid:652c64aa-d628-4ff1-89b7-8d9777691128",1611022330,"uuid:652c64aa-d628-4ff1-89b7-8d9777691128",57
"25","11/8/2016 21:19","11/8/2016 16:07","11/8/2016 16:35",3,NA,NA,NA,NA,1,NA,"11/8/2016 16:07","V307232",1,46,1,NA,1,3,"I was selected by the citizens",2,"Farming",NA,NA,NA,NA,NA,NA,NA,1,15,NA,1,25,65,NA,3,1,NA,0,"0",0,NA,NA,NA,NA,NA,NA,NA,NA,NA,NA,NA,NA,1,2,2,NA,"I call the two of them and counsel them",46,1,1,1,NA,2,2,1,1,3,5,1,NA,"uuid:693127f5-a2de-4796-901c-e751fc5f7e16",1611022330,"uuid:693127f5-a2de-4796-901c-e751fc5f7e16",56
"26","11/8/2016 21:31","11/8/2016 17:01","11/8/2016 17:26",3,NA,NA,NA,NA,1,NA,"11/8/2016 19:01","V307234",2,47,2,NA,NA,NA,NA,NA,NA,NA,2,1,"The former nabakyala got a problem and people chosen me",2,"Farming",NA,1,30,NA,1,45,NA,NA,NA,NA,NA,4,"0",0,NA,NA,4,0,0,0,0,0,0,"0",0,NA,NA,NA,2,NA,"I call them and ask the reasons for fighting and then counsel them accordingly",25,2,1,1,NA,2,4,1,1,3,7,2,NA,"uuid:388dfde3-88f5-4f72-be3b-ce54b3da2a5f",1611022330,"uuid:388dfde3-88f5-4f72-be3b-ce54b3da2a5f",69
"27","11/8/2016 21:31","11/8/2016 17:39","11/8/2016 18:05",3,NA,NA,NA,NA,1,NA,"11/8/2016 17:39","V307231",2,37,1,NA,2,3,"I was selected by the chairperson of our village",2,"Farming",NA,NA,NA,NA,NA,NA,NA,1,30,NA,1,60,89,NA,3,1,NA,3,"0",0,NA,NA,3,0,0,0,0,0,0,"0",0,NA,NA,NA,2,NA,"I ask her why she was beaten and then call the husband for counseling",24,2,1,1,NA,2,2,2,2,3,6,1,NA,"uuid:c77bbdef-1264-4acf-8f4d-40c72fb5405a",1611022330,"uuid:c77bbdef-1264-4acf-8f4d-40c72fb5405a",56
"28","11/8/2016 21:39","11/8/2016 13:51","11/8/2016 14:14",4,NA,NA,NA,NA,1,NA,"11/8/2016 13:51","V306241",2,38,1,NA,2,5,"I was elected by the residents of my village in the local council",2,"Farming",NA,NA,NA,NA,NA,NA,NA,1,1,NA,2,2,51,NA,3,4,NA,3,"0",0,NA,NA,3,0,0,0,0,0,0,"0",0,NA,NA,NA,1,"They fear for their husbands being imprisoned","I always first listen to the cause of the fight and then I counsel them",19,2,1,1,NA,2,2,1,1,3,7,2,NA,"uuid:50f8cb78-aac8-4bbe-b48e-eb3102ca4592",1611022330,"uuid:50f8cb78-aac8-4bbe-b48e-eb3102ca4592",53
"29","11/8/2016 21:40","11/8/2016 16:38","11/8/2016 17:20",4,NA,NA,NA,NA,1,NA,"11/8/2016 16:39","V306241",1,40,1,NA,2,5,"The LC1 committee members elected me",2,"Farming",NA,NA,NA,NA,NA,NA,NA,1,1,NA,2,2,65,NA,3,2,NA,2,"They always get a lot of counseling from me in marital issues",4,NA,NA,0,1,0,0,0,0,0,"I personally had them fight and I intervened",1,NA,NA,NA,1,"They always fear their husbands being imprisoned and yet they still love them","I first find out as to why she was beaten,then I give him a long counseling",8,2,1,1,NA,2,2,1,1,2,8,NA,NA,"uuid:367d81e1-2231-4c38-86f4-86af05676eaf",1611022330,"uuid:367d81e1-2231-4c38-86f4-86af05676eaf",53
"30","11/9/2016 18:36","11/9/2016 15:31","11/9/2016 16:43",2,NA,NA,NA,NA,1,NA,"11/9/2016 15:42","V307233",2,45,1,NA,2,3,"2013",2,"Yes",NA,NA,NA,NA,NA,NA,NA,2,2,NA,2,2,50,NA,4,0,NA,1,"0",0,NA,NA,1,0,0,0,0,0,0,"0",0,NA,NA,NA,1,"They don't go to the hospital","Go to nabakyala",45,2,1,1,NA,2,4,2,1,3,7,NA,NA,"uuid:0159dc5d-0f5d-4aab-84a8-0843226f4747",1611022330,"uuid:0159dc5d-0f5d-4aab-84a8-0843226f4747",56
"31","11/9/2016 20:29","11/9/2016 12:52","11/9/2016 13:05",4,NA,NA,NA,NA,1,NA,"11/9/2016 12:53","V306061",1,42,1,NA,2,2,"I was invited over by a health organization that was training VHTs",2,"Farming",NA,NA,NA,NA,NA,NA,NA,2,1,NA,2,2,50,NA,3,3,NA,0,"0",0,NA,NA,NA,NA,NA,NA,NA,NA,NA,NA,NA,NA,1,1,2,NA,"To beigin giving her husband respect",19,3,1,1,NA,2,2,2,1,3,5,2,NA,"uuid:031bfe6e-a866-41d1-bb62-b42ff3475964",1611022330,"uuid:031bfe6e-a866-41d1-bb62-b42ff3475964",50
"32","11/9/2016 20:29","11/9/2016 13:32","11/9/2016 13:49",4,NA,NA,NA,NA,1,NA,"11/9/2016 13:32","V306062",2,50,2,NA,NA,NA,NA,NA,NA,NA,2,5,"She was elected by the residents of kibalangulu",2,"Farming",NA,1,30,NA,1,90,NA,NA,NA,NA,NA,0,"0",0,NA,NA,NA,NA,NA,NA,NA,NA,NA,NA,NA,NA,2,NA,2,NA,"I advise her to go for counseling",22,3,1,1,NA,2,2,2,NA,NA,6,1,NA,"uuid:61b317d9-0c7e-4c1b-95a7-b072f979ff30",1611022330,"uuid:61b317d9-0c7e-4c1b-95a7-b072f979ff30",50
"33","11/9/2016 20:31","11/9/2016 10:35","11/9/2016 12:37",2,NA,NA,NA,NA,1,NA,"11/9/2016 10:35","V409082",1,60,2,NA,NA,NA,NA,NA,NA,NA,2,25,"People choose her ",2,"Farming ",NA,2,2,NA,2,3,NA,NA,NA,NA,NA,5,"How to get food ",0,NA,NA,3,1,0,0,1,0,0,"O",0,NA,NA,NA,1,"Because they don't have money and health facilities are far ","I try to tell her that don't leave your home ",14,3,1,2,NA,2,1,2,1,4,7,NA,NA,"uuid:52269995-78df-47b2-9643-6848796bcb82",1611022330,"uuid:52269995-78df-47b2-9643-6848796bcb82",92
"34","11/10/2016 19:59","11/10/2016 12:59","11/10/2016 13:36",4,NA,NA,NA,NA,1,NA,"11/10/2016 13:00","V307091",1,60,1,NA,2,4,"I was appointed by the Health center of my subcounty",2,"Farmer",NA,NA,NA,NA,NA,NA,NA,1,5,NA,1,30,50,NA,3,2,NA,0,"They always ask me about the how we can improve on the issues of our primary school",30,NA,NA,NA,NA,NA,NA,NA,NA,NA,NA,NA,NA,2,NA,2,NA,"She should utilize the chairman to intervene in her issues",57,3,1,1,NA,2,2,NA,1,NA,7,3,NA,"uuid:54428710-5911-4a6f-b1bf-b83d516a4aed",1611022330,"uuid:54428710-5911-4a6f-b1bf-b83d516a4aed",54
"35","11/10/2016 20:00","11/10/2016 14:07","11/10/2016 14:26",4,NA,NA,NA,NA,1,NA,"11/10/2016 14:07","V307092",2,42,1,NA,2,5,"I was elected by the residents of this area",2,"Farmer",NA,NA,NA,NA,NA,NA,NA,1,30,NA,2,1,45,NA,3,1,NA,0,"0",0,NA,NA,NA,NA,NA,NA,NA,NA,NA,NA,NA,NA,1,1,1,"She fears the husband being imprisoned","I first arrange a counseling meeting for both of them",30,1,1,1,NA,2,2,2,2,3,7,2,NA,"uuid:5e749178-2708-4727-8088-7b93479a0708",1611022330,"uuid:5e749178-2708-4727-8088-7b93479a0708",54
"36","11/10/2016 20:00","11/10/2016 15:35","11/10/2016 15:53",4,NA,NA,NA,NA,1,NA,"11/10/2016 15:35","V307093",2,62,1,NA,2,5,"I was elected by the village residents",2,"Farmer",NA,NA,NA,NA,NA,NA,NA,1,20,NA,2,1,50,NA,3,1,NA,0,"0",0,NA,NA,NA,NA,NA,NA,NA,NA,NA,NA,NA,NA,1,1,2,NA,"I counsel them",20,2,2,2,NA,2,1,2,1,2,8,NA,NA,"uuid:b0d8111e-61fd-440d-bbef-c9730b1cc079",1611022330,"uuid:b0d8111e-61fd-440d-bbef-c9730b1cc079",54
"37","11/10/2016 20:10","11/10/2016 9:03","11/10/2016 9:27",3,NA,NA,NA,NA,1,NA,"11/10/2016 9:03","V306051",2,32,1,NA,2,4,"Was  selected through USAiD project ",2,"Retail shop ",NA,NA,NA,NA,NA,NA,NA,2,2,NA,1,10,70,NA,3,1,NA,3,"O",0,NA,NA,3,0,0,0,0,0,0,"O",0,NA,NA,NA,2,NA,"Tell her to go for medication first ",15,1,1,1,NA,2,2,2,1,NA,7,4,NA,"uuid:3520e988-1f3c-45c3-a986-a5ca82c414c9",1611022330,"uuid:3520e988-1f3c-45c3-a986-a5ca82c414c9",49
"38","11/10/2016 20:10","11/10/2016 9:32","11/10/2016 9:51",2,NA,NA,NA,NA,1,NA,"11/10/2016 9:32","V306052",2,47,1,NA,2,4,"Through Usaid project ",2,"Has clinic ",NA,NA,NA,NA,NA,NA,NA,2,2,NA,1,5,70,NA,3,1,NA,5,"O",0,NA,NA,1,0,2,1,1,0,0,"O",0,NA,NA,NA,2,NA,"Try to cool her down and tell her to go back home ",47,1,1,1,NA,2,1,1,2,2,7,2,NA,"uuid:950feba0-aa2f-438a-9a3a-10588506e949",1611022330,"uuid:950feba0-aa2f-438a-9a3a-10588506e949",49
"39","11/10/2016 20:11","11/10/2016 11:44","11/10/2016 12:11",2,NA,NA,NA,NA,1,NA,"11/10/2016 11:44","V306053",2,50,1,NA,2,12,"Community selected us",2,"Farming ",NA,NA,NA,NA,NA,NA,NA,2,1,NA,1,15,75,NA,3,1,NA,4,"About dewarming",20,NA,NA,3,1,0,0,0,0,0,"O",0,NA,NA,NA,2,NA,"Try to get in touch with the husband ",23,2,1,1,NA,2,1,1,1,2,7,3,NA,"uuid:903e42b1-9023-465b-b441-fdc816767b42",1611022330,"uuid:903e42b1-9023-465b-b441-fdc816767b42",49
"40","11/10/2016 20:20","11/10/2016 12:37","11/10/2016 13:04",2,NA,NA,NA,NA,1,NA,"11/10/2016 12:37","V306054",2,65,1,NA,2,3,"Doctors trained her and later took over as VHT",2,"Farming and tailoring ",NA,NA,NA,NA,NA,NA,NA,2,1,NA,1,5,80,NA,3,1,NA,0,"Pregnant women ",2,NA,NA,NA,NA,NA,NA,NA,NA,NA,NA,NA,NA,2,NA,2,NA,"First investigate who is wrong and advise accordingly ",30,2,1,1,NA,2,1,2,1,3,7,3,NA,"uuid:6b1a7637-9ca2-4e45-b747-6f86f4cfda34",1611022330,"uuid:6b1a7637-9ca2-4e45-b747-6f86f4cfda34",49
"41","11/11/2016 12:03","11/9/2016 14:56","11/9/2016 15:46",3,NA,NA,NA,NA,1,NA,"11/9/2016 15:03","V306073",1,51,1,NA,2,10,"I was voted by the citizens",2,"Farming",NA,NA,NA,NA,NA,NA,NA,1,20,NA,1,30,40,NA,3,1,NA,0,"Defilement",1,NA,NA,NA,NA,NA,NA,NA,NA,NA,NA,NA,NA,2,NA,2,NA,"I help her according to the reasons why she was beaten",44,2,1,1,NA,2,2,1,1,3,7,4,NA,"uuid:38f2f6bd-d163-42a4-9cdc-37610b598504",1611022330,"uuid:38f2f6bd-d163-42a4-9cdc-37610b598504",51
"42","11/11/2016 12:03","11/10/2016 10:11","11/10/2016 10:42",3,NA,NA,NA,NA,1,NA,"11/10/2016 10:14","V307121",2,53,1,NA,2,15,"I was voted by the people",2,"Farming",NA,NA,NA,NA,NA,NA,NA,1,30,NA,2,1,50,NA,3,1,NA,1,"Education, complaints about bad schools",2,NA,NA,1,0,0,0,0,0,0,"0",0,NA,NA,NA,2,NA,"I go to their home and I talk to all of them",16,2,1,1,NA,2,1,2,2,3,5,1,NA,"uuid:a6e94ffc-63d1-4138-aed0-1b35976bd6d2",1611022330,"uuid:a6e94ffc-63d1-4138-aed0-1b35976bd6d2",55
"43","11/11/2016 12:03","11/10/2016 12:16","11/10/2016 12:34",3,NA,NA,NA,NA,1,NA,"11/10/2016 12:17","V307122",2,53,1,NA,2,4,"I was voted by people",2,"Farming",NA,NA,NA,NA,NA,NA,NA,1,20,NA,2,1,60,NA,3,2,NA,3,"0",0,NA,NA,3,0,0,0,0,0,0,"0",0,NA,NA,NA,2,NA,"I go there at home and ask all of them to reconcile",26,2,1,1,NA,2,2,2,1,3,7,4,NA,"uuid:b5c66c81-3f7a-4ffc-a3aa-d984866ec4d4",1611022330,"uuid:b5c66c81-3f7a-4ffc-a3aa-d984866ec4d4",55
"44","11/11/2016 12:03","11/11/2016 11:27","11/11/2016 12:02",3,NA,NA,NA,NA,1,NA,"11/11/2016 11:49","V309142",2,38,2,NA,NA,NA,NA,NA,NA,NA,2,20,"Women voted for me",2,"Farming",NA,1,30,NA,1,30,NA,NA,NA,NA,NA,3,"0",0,NA,NA,3,0,0,0,0,0,0,"0",0,NA,NA,NA,2,NA,"I talk to the husband to know the reason and then counsel them",24,2,1,1,NA,2,1,2,NA,NA,7,4,NA,"uuid:85243a00-c48f-42fd-a14f-1213599f8248",1611022330,"uuid:85243a00-c48f-42fd-a14f-1213599f8248",42
"45","11/11/2016 19:55","11/10/2016 11:31","11/10/2016 12:34",2,NA,NA,NA,NA,1,NA,"11/10/2016 11:31","V302031",2,47,1,NA,2,20,"I started as volunteer for HIV programmes and later became a local VHT ",1,"Poultry and livestock ",NA,NA,NA,NA,NA,NA,NA,1,2,NA,1,30,50,NA,2,3,NA,9,"Rape",17,NA,NA,8,1,0,0,0,0,0,"0",0,NA,NA,NA,2,NA,"I ask her for the reason, then I base on that reason to talk to her husband",30,2,1,1,NA,1,2,1,1,3,8,1,NA,"uuid:0f5dddfc-403c-446c-bde5-41375a13437a",1611022330,"uuid:0f5dddfc-403c-446c-bde5-41375a13437a",44
"46","11/11/2016 19:56","11/10/2016 13:03","11/10/2016 13:28",2,NA,NA,NA,NA,1,NA,"11/10/2016 13:04","V302032",1,30,1,NA,2,7,"I was appointed by the people to volunteer as a VHT ",2,"Farming and retail business ",NA,NA,NA,NA,NA,NA,NA,1,5,NA,1,5,150,NA,3,2,NA,4,"0",0,NA,NA,4,0,0,0,0,0,0,"0",0,NA,NA,NA,2,NA,"I advise her to seek  the  law ",12,2,1,1,NA,1,2,1,1,3,7,4,NA,"uuid:87158fe3-3ef7-41df-b1de-dbef57d863cd",1611022330,"uuid:87158fe3-3ef7-41df-b1de-dbef57d863cd",44
"47","11/11/2016 19:56","11/11/2016 10:53","11/11/2016 11:23",2,NA,NA,NA,NA,1,NA,"11/11/2016 10:53","V111111",2,44,1,NA,2,12,"I was appointed by the sub country hospital in charge to serve my area  ",1,"Farming, retail ",NA,NA,NA,NA,NA,NA,NA,1,20,NA,1,20,102,NA,4,4,NA,2,"0",0,NA,NA,2,0,0,0,0,0,0,"0",0,NA,NA,NA,2,NA,"I talk to her husband about it then assemble a committee to counsel the couple",25,2,1,1,NA,1,2,1,1,3,7,3,NA,"uuid:5e68f04e-5185-4c01-8dfa-948fd666005d",1611022330,"uuid:5e68f04e-5185-4c01-8dfa-948fd666005d",59
"48","11/11/2016 19:56","11/11/2016 16:03","11/11/2016 16:14",2,NA,NA,NA,NA,1,NA,"11/11/2016 16:03","V333333",1,33,1,NA,1,3,"I was appointed by the chairperson ",2,"Farming , boda boda",NA,NA,NA,NA,NA,NA,NA,1,20,NA,1,20,102,NA,3,0,NA,0,"0",0,NA,NA,NA,NA,NA,NA,NA,NA,NA,NA,NA,NA,2,NA,2,NA,"I talk to them both as a couple ",33,2,1,1,NA,1,2,2,1,3,7,2,NA,"uuid:535457bf-6327-46e7-927a-714c61b49fe9",1611022330,"uuid:535457bf-6327-46e7-927a-714c61b49fe9",59
"49","11/11/2016 20:31","11/11/2016 13:48","11/11/2016 14:24",3,NA,NA,NA,NA,1,NA,"11/11/2016 13:48","V306072",2,41,1,NA,2,4,"She started with volunteering in distribution of deworming tablets in the community.",2,"Owns shop",NA,NA,NA,NA,NA,NA,NA,1,5,NA,2,1,167,NA,2,1,NA,6,"0",0,NA,NA,4,0,2,0,0,0,0,"0",0,NA,NA,NA,1,"Because of poverty and the women fearing their husbands","She calls them both and counsels them together.",20,2,1,1,NA,1,2,1,1,2,7,1,NA,"uuid:838d9c9f-c08f-4da1-8efc-c606d6281212",1611022330,"uuid:838d9c9f-c08f-4da1-8efc-c606d6281212",51
