"153","11/25/2016 19:11","11/25/2016 13:39","11/25/2016 14:03",3,NA,NA,NA,NA,1,NA,"11/25/2016 13:39","V102142",1,40,1,NA,2,6,"I always loved during voluntary work in my village and people trusted me alot and i was elected",2,"Sells matooke",NA,NA,NA,NA,NA,NA,NA,1,3,NA,1,40,100,NA,3,1,NA,1,"0",0,NA,NA,1,0,0,0,0,0,0,"0",0,NA,NA,NA,2,NA,"I seat them both with the husband and i counsel them",40,2,1,1,NA,2,1,2,1,3,7,1,NA,"uuid:432a7315-3870-4b30-b422-64b6bf1a723e",1611022330,"uuid:432a7315-3870-4b30-b422-64b6bf1a723e",3
"154","11/25/2016 19:40","11/25/2016 10:31","11/25/2016 11:28",4,NA,NA,NA,NA,1,NA,"11/25/2016 10:31","V101091",1,32,1,NA,2,5,"I was appointed by the chairperson of my village",2,"He has a retail shop",NA,NA,NA,NA,NA,NA,NA,1,30,NA,1,2,120,NA,3,5,NA,0,"0",0,NA,NA,NA,NA,NA,NA,NA,NA,NA,NA,NA,NA,1,3,1,"She fears causing imprisonment to the husband","I first find out why she is being beaten",10,2,1,2,NA,2,4,1,1,3,7,1,NA,"uuid:fee81de2-4f10-48be-8e22-5882117e1e2f",1611022330,"uuid:fee81de2-4f10-48be-8e22-5882117e1e2f",1
"155","11/25/2016 19:40","11/25/2016 13:58","11/25/2016 14:21",4,NA,NA,NA,NA,1,NA,"11/25/2016 13:58","V101092",2,43,1,NA,2,5,"I was appointed by the chief of the subcounty",2,"Farmer",NA,NA,NA,NA,NA,NA,NA,1,30,NA,1,30,50,NA,3,1,NA,0,"0",0,NA,NA,NA,NA,NA,NA,NA,NA,NA,NA,NA,NA,1,3,2,NA,"I first inquire from both of them the cause of the fight then I counsel them",27,2,1,1,NA,2,2,2,2,3,7,4,NA,"uuid:1b8120bb-5a5a-484d-b189-f8e9c82740c6",1611022330,"uuid:1b8120bb-5a5a-484d-b189-f8e9c82740c6",1
"156","11/25/2016 19:41","11/25/2016 16:16","11/25/2016 16:34",4,NA,NA,NA,NA,1,NA,"11/25/2016 16:16","V101094",2,49,1,NA,2,5,"I was elected by the LC1 committee",2,"Farmer",NA,NA,NA,NA,NA,NA,NA,1,20,NA,1,30,300,NA,3,1,NA,0,"0",0,NA,NA,NA,NA,NA,NA,NA,NA,NA,NA,NA,NA,1,2,2,NA,"I first ask her why she is always being beaten then I counsel the couple",20,2,1,1,NA,2,2,2,1,2,7,2,NA,"uuid:9bea04d4-48b5-486c-8474-8f6b42c28012",1611022330,"uuid:9bea04d4-48b5-486c-8474-8f6b42c28012",1
"157","11/25/2016 19:41","11/25/2016 14:39","11/25/2016 15:00",4,NA,NA,NA,NA,1,NA,"11/25/2016 14:40","V101093",2,55,2,NA,NA,NA,NA,NA,NA,NA,2,15,"I was elected by my residents",2,"Farmer",NA,1,20,NA,1,30,NA,NA,NA,NA,NA,0,"0",0,NA,NA,NA,NA,NA,NA,NA,NA,NA,NA,NA,NA,1,5,2,NA,"I hear from both sides then I counsel them",55,3,1,1,NA,2,2,2,1,3,7,1,NA,"uuid:64426373-f95a-4f58-a4fc-7b0e1fc41f90",1611022330,"uuid:64426373-f95a-4f58-a4fc-7b0e1fc41f90",1
"158","11/25/2016 20:07","11/25/2016 12:24","11/25/2016 12:42",2,NA,NA,NA,NA,1,NA,"11/25/2016 12:26","v107072",1,42,1,NA,2,6,"I was voted by the village people ",2,"farming",NA,NA,NA,NA,NA,NA,NA,1,30,NA,1,50,160,NA,3,1,NA,0,"0",0,NA,NA,NA,NA,NA,NA,NA,NA,NA,NA,NA,NA,1,2,2,NA,"I try to talk to her husband and if it all fails then I refer to a probation officer",35,1,1,1,NA,1,2,2,1,2,7,2,NA,"uuid:7331f63e-fc7d-4969-a607-deaf3e1d1ad9",1611022330,"uuid:7331f63e-fc7d-4969-a607-deaf3e1d1ad9",12
"159","11/26/2016 19:55","11/26/2016 10:38","11/26/2016 11:10",2,NA,NA,NA,NA,1,NA,"11/26/2016 10:38","v105041",2,39,1,NA,2,5,"The chairperson appointed me to train as a VHT",2,"farming ",NA,NA,NA,NA,NA,NA,NA,1,10,NA,1,30,150,NA,3,1,NA,3,"0",0,NA,NA,3,0,0,0,0,0,0,"0",0,NA,NA,NA,2,NA,"depending on the reasons for her being hit, I may refer her to the police",38,2,1,1,NA,1,1,2,2,3,7,1,NA,"uuid:7bfcbf88-b838-4276-9e02-cb0904815ac7",1611022330,"uuid:7bfcbf88-b838-4276-9e02-cb0904815ac7",10
"160","11/26/2016 19:55","11/26/2016 11:28","11/26/2016 11:51",2,NA,NA,NA,NA,1,NA,"11/26/2016 11:28","v105042",2,55,1,NA,2,10,"The chairperson selected me to participate in a VHT training ",2,"farming ",NA,NA,NA,NA,NA,NA,NA,1,20,NA,1,40,150,NA,2,1,NA,0,"0",0,NA,NA,NA,NA,NA,NA,NA,NA,NA,NA,NA,NA,1,3,2,NA,"I also her if she would want me to talk to her husband about the issue",26,2,1,1,NA,1,4,2,1,3,7,4,NA,"uuid:80725b45-4f15-408d-9fb4-39b93d2611c0",1611022330,"uuid:80725b45-4f15-408d-9fb4-39b93d2611c0",10
"161","11/26/2016 19:55","11/26/2016 12:44","11/26/2016 13:05",2,NA,NA,NA,NA,1,NA,"11/26/2016 12:49","v105044",2,48,1,NA,2,6,"I was appointed by the chairman of the village ",2,"farming ",NA,NA,NA,NA,NA,NA,NA,1,15,NA,1,20,250,NA,3,1,NA,1,"0",0,NA,NA,1,0,0,0,0,0,0,"0",0,NA,NA,NA,2,NA,"I ask her if she knows the reason why her husband beats her",10,3,1,1,NA,1,2,2,1,3,7,4,NA,"uuid:9a0a8bc4-7120-46f7-a619-d32bfbeeea8c",1611022330,"uuid:9a0a8bc4-7120-46f7-a619-d32bfbeeea8c",10
"162","11/26/2016 19:55","11/26/2016 12:03","11/26/2016 12:31",2,NA,NA,NA,NA,1,NA,"11/26/2016 12:04","v105043",2,52,1,NA,2,6,"I was elected by the people ",2,"farming ",NA,NA,NA,NA,NA,NA,NA,1,10,NA,1,30,200,NA,3,2,NA,2,"0",0,NA,NA,2,0,0,0,0,0,0,"0",0,NA,NA,NA,2,NA,"I talk to the couple and offer counselling ",33,2,1,1,NA,1,4,2,2,3,7,3,NA,"uuid:f02ad81d-8e8b-4078-a40e-98d2344f45bd",1611022330,"uuid:f02ad81d-8e8b-4078-a40e-98d2344f45bd",10
"163","11/26/2016 19:58","11/26/2016 10:08","11/26/2016 10:23",2,NA,NA,NA,NA,1,NA,"11/26/2016 10:09","V102143",1,40,1,NA,2,3,"Lc 1 choose me ",2,"I do farming ",NA,NA,NA,NA,NA,NA,NA,1,30,NA,2,1,70,NA,3,1,NA,0,"O",0,NA,NA,NA,NA,NA,NA,NA,NA,NA,NA,NA,NA,2,NA,2,NA,"To go to lC I ",40,1,1,1,NA,2,1,2,1,4,8,4,NA,"uuid:2ea7006e-a6c8-4e56-b73d-718cb395db56",1611022330,"uuid:2ea7006e-a6c8-4e56-b73d-718cb395db56",3
"164","11/26/2016 19:59","11/26/2016 9:26","11/26/2016 10:07",4,NA,NA,NA,NA,1,NA,"11/26/2016 9:26","V104021",1,30,1,NA,2,6,"I was appointed by village leaders and Lc1 committee",2,"Farmer",NA,NA,NA,NA,NA,NA,NA,1,30,NA,2,1,62,NA,4,4,NA,1,"0",0,NA,NA,1,0,0,0,0,0,0,"0",0,NA,NA,NA,2,NA,"I call them together and counsel the couple",6,2,1,1,NA,2,2,2,1,3,6,1,NA,"uuid:6d1018f1-e3bb-45af-b528-ee71ded62a04",1611022330,"uuid:6d1018f1-e3bb-45af-b528-ee71ded62a04",8
"165","11/26/2016 19:59","11/26/2016 16:04","11/26/2016 16:22",4,NA,NA,NA,NA,1,NA,"11/26/2016 16:04","V104024",2,34,2,NA,NA,NA,NA,NA,NA,NA,2,3,"I was elected by the residents of the village",2,"Farmer",NA,1,30,NA,1,20,NA,NA,NA,NA,NA,1,"0",0,NA,NA,1,0,0,0,0,0,0,"0",0,NA,NA,NA,1,"Sometimes she fears destroying her marriage in case she is sent to report to police after going to hospital","I first listen to as to as why she was beaten and then advise her accordingly",13,3,1,1,NA,2,4,2,2,3,7,1,NA,"uuid:eba361c0-e0be-4650-85aa-4e89d211bb08",1611022330,"uuid:eba361c0-e0be-4650-85aa-4e89d211bb08",8
"166","11/26/2016 19:59","11/26/2016 11:10","11/26/2016 11:25",4,NA,NA,NA,NA,1,NA,"11/26/2016 11:10","V104022",2,32,1,NA,2,6,"I was elected by the village residents",2,"Farmer",NA,NA,NA,NA,NA,NA,NA,1,30,NA,1,20,226,NA,3,1,NA,7,"0",0,NA,NA,7,0,0,0,0,0,0,"0",0,NA,NA,NA,2,NA,"I call the couple and then I counsel them",13,2,1,1,NA,2,2,1,2,3,7,1,NA,"uuid:f7d44f27-38d4-407a-9b7b-9c6c422beb21",1611022330,"uuid:f7d44f27-38d4-407a-9b7b-9c6c422beb21",8
"167","11/28/2016 17:40","11/28/2016 12:00","11/28/2016 12:32",3,NA,NA,NA,NA,1,NA,"11/28/2016 12:02","V104023",2,30,1,NA,1,12,"One of the VHT stopped volunteering and the chairman asked me to replace her",2,"Farming",NA,NA,NA,NA,NA,NA,NA,1,10,NA,1,30,200,NA,4,3,NA,0,"0",0,NA,NA,NA,NA,NA,NA,NA,NA,NA,NA,NA,NA,2,NA,2,NA,"I tell her to report to the LC1",30,2,1,1,NA,2,1,2,2,3,7,4,NA,"uuid:b00b5d61-decc-485c-95fe-f3bcaf58b268",1611022330,"uuid:b00b5d61-decc-485c-95fe-f3bcaf58b268",8
"168","11/28/2016 18:53","11/28/2016 10:45","11/28/2016 11:08",4,NA,NA,NA,NA,1,NA,"11/28/2016 10:47","V205161",1,30,1,NA,2,4,"I was elected by the village LC committee",2,"He is a teacher",NA,NA,NA,NA,NA,NA,NA,1,30,NA,1,25,220,NA,3,1,NA,0,"0",0,NA,NA,NA,NA,NA,NA,NA,NA,NA,NA,NA,NA,1,2,1,"Sometimes they don't have transport yet it's their husbands that have to give them such transport","I first ask her as to why she was beaten and later I meet the husband to counsel him not to beat the lady",16,2,1,1,NA,2,2,2,1,3,4,2,NA,"uuid:0e603aec-f728-4234-95c2-0eb4441e1be6",1611022330,"uuid:0e603aec-f728-4234-95c2-0eb4441e1be6",29
"169","11/28/2016 18:53","11/28/2016 11:27","11/28/2016 11:52",4,NA,NA,NA,NA,1,NA,"11/28/2016 11:27","V205162",2,44,1,NA,2,4,"The lc1 chairman called me up for the post",2,"Owns a restaurant",NA,NA,NA,NA,NA,NA,NA,1,30,NA,1,15,220,NA,3,2,NA,0,"The residents always ask us that we see you VHTs over work but are you paid",5,NA,NA,NA,NA,NA,NA,NA,NA,NA,NA,NA,NA,2,NA,2,NA,"I first inquire as to why she was beaten up then advise her accordingly",24,2,1,1,NA,2,2,2,1,3,7,1,NA,"uuid:07bf13fa-7a5b-4de1-bd5e-5a766625f0af",1611022330,"uuid:07bf13fa-7a5b-4de1-bd5e-5a766625f0af",29
"170","11/28/2016 21:14","11/28/2016 11:28","11/28/2016 11:39",2,NA,NA,NA,NA,1,NA,"11/28/2016 11:28","v205091",1,25,1,NA,1,6,"I was appointed by an active VHT ",2,"farming ",NA,NA,NA,NA,NA,NA,NA,1,2,NA,2,1,48,NA,3,2,NA,6,"0",0,NA,NA,6,0,0,0,0,0,0,"0",0,NA,NA,NA,2,NA,"I talk to the husband and find out the cause of the trouble",16,2,1,1,NA,1,4,2,1,2,6,1,NA,"uuid:502b47f6-fb0c-4706-b6d7-831afcb7533c",1611022330,"uuid:502b47f6-fb0c-4706-b6d7-831afcb7533c",26
"171","11/28/2016 21:14","11/28/2016 16:04","11/28/2016 16:16",2,NA,NA,NA,NA,1,NA,"11/28/2016 16:05","v205093",2,43,1,NA,2,4,"I was appointed by the LC1 committe ",2,"teaching ",NA,NA,NA,NA,NA,NA,NA,1,30,NA,2,45,89,NA,3,1,NA,3,"0",0,NA,NA,3,0,0,0,0,0,0,"0",0,NA,NA,NA,2,NA,"I tell her to be obidient to her husband a and try to solve this issue",43,1,1,1,NA,1,2,2,1,3,7,4,NA,"uuid:9d90b5cc-2317-49d1-afdd-10e362a067a7",1611022330,"uuid:9d90b5cc-2317-49d1-afdd-10e362a067a7",26
"172","11/28/2016 21:14","11/28/2016 15:44","11/28/2016 15:59",2,NA,NA,NA,NA,1,NA,"11/28/2016 15:44","v205091",2,54,1,NA,2,12,"The parish chief came to my village and asked for volunteers ",2,"farming and poultry ",NA,NA,NA,NA,NA,NA,NA,1,2,NA,2,30,87,NA,3,1,NA,2,"0",0,NA,NA,2,0,0,0,0,0,0,"0",0,NA,NA,NA,2,NA,"I tell her to report the case to the LC1 chairperson ",29,1,1,1,NA,1,1,2,1,2,7,4,NA,"uuid:35c1f18a-26e0-4acb-9499-b5f83fdcf845",1611022330,"uuid:35c1f18a-26e0-4acb-9499-b5f83fdcf845",26
"173","11/29/2016 17:22","11/29/2016 10:12","11/29/2016 11:10",3,NA,NA,NA,NA,1,NA,"11/29/2016 10:12","V205163",2,38,2,NA,NA,NA,NA,NA,NA,NA,2,5,"People trusted me and i was elected",2,"Farming",NA,1,15,NA,2,3,NA,NA,NA,NA,NA,25,"0",0,NA,NA,8,3,3,6,1,2,2,"0",0,NA,NA,NA,2,NA,"I call for ameeting and i counsel them both",37,2,1,1,NA,1,1,2,2,2,5,1,NA,"uuid:eb748370-fe47-47ce-ac7b-c4096a553205",1611022330,"uuid:eb748370-fe47-47ce-ac7b-c4096a553205",29
"174","11/29/2016 18:25","11/29/2016 11:32","11/29/2016 12:26",3,NA,NA,NA,NA,1,NA,"11/29/2016 11:32","V107102",2,36,1,NA,2,5,"Training",2,"Farming",NA,NA,NA,NA,NA,NA,NA,1,30,NA,1,40,150,NA,3,1,NA,0,"0",0,NA,NA,NA,NA,NA,NA,NA,NA,NA,NA,NA,NA,2,NA,2,NA,"Counselling her",16,2,1,1,NA,1,4,1,1,2,8,4,NA,"uuid:8b0bd7c6-d4e8-47ae-a330-55f1e0fa77e9",1611022330,"uuid:8b0bd7c6-d4e8-47ae-a330-55f1e0fa77e9",13
"175","11/29/2016 19:13","11/29/2016 9:54","11/29/2016 10:13",4,NA,NA,NA,NA,1,NA,"11/29/2016 9:54","V204041",2,28,1,NA,2,6,"I was elected by the residents of my village",2,"Farmer",NA,NA,NA,NA,NA,NA,NA,1,2,NA,1,20,185,NA,4,4,NA,5,"0",0,NA,NA,1,0,0,0,0,0,4,"0",0,NA,NA,NA,1,"They fear their husbands being imprisoned","I advise her to go to the Lc1 for counseling",28,1,1,1,NA,2,2,1,1,3,6,1,NA,"uuid:693bc4cd-2154-4163-aa59-066f04f54e7b",1611022330,"uuid:693bc4cd-2154-4163-aa59-066f04f54e7b",22
"176","11/29/2016 19:13","11/29/2016 10:58","11/29/2016 11:15",4,NA,NA,NA,NA,1,NA,"11/29/2016 10:58","V204042",2,46,2,NA,NA,NA,NA,NA,NA,NA,2,10,"I was elected by the village residents",2,"She brews and sells alcohol",NA,1,4,NA,1,35,NA,NA,NA,NA,NA,3,"0",0,NA,NA,3,0,0,0,0,0,0,"0",0,NA,NA,NA,2,NA,"I advise her to go to the law makers",44,3,1,1,NA,2,1,2,1,3,7,2,NA,"uuid:a4d03605-0ade-4389-b82a-6dedf8539a27",1611022330,"uuid:a4d03605-0ade-4389-b82a-6dedf8539a27",22
"177","11/29/2016 19:13","11/29/2016 12:34","11/29/2016 13:00",4,NA,NA,NA,NA,1,NA,"11/29/2016 12:35","V204043",1,46,1,NA,2,3,"I was elected by the LC1 committee",2,"Farmer",NA,NA,NA,NA,NA,NA,NA,1,5,NA,1,45,60,NA,2,2,NA,2,"0",0,NA,NA,2,0,0,0,0,0,0,"0",0,NA,NA,NA,1,"They fear opening up cases on their husbands for what they did","I first inquire the cause from both then I counsel them",46,NA,1,1,NA,1,2,1,1,3,7,1,NA,"uuid:8660f5fc-8719-4e78-85a0-5251f21c805a",1611022330,"uuid:8660f5fc-8719-4e78-85a0-5251f21c805a",22
"178","11/29/2016 19:56","11/29/2016 17:57","11/29/2016 18:18",3,NA,NA,NA,NA,1,NA,"11/29/2016 17:57","V203023",2,45,1,NA,2,6,"There was a village meeting and we were nominated",2,"Tailoring and hawking clothes ",NA,NA,NA,NA,NA,NA,NA,1,15,NA,2,1,150,NA,2,1,NA,0,"0",0,NA,NA,NA,NA,NA,NA,NA,NA,NA,NA,NA,NA,2,NA,2,NA,"I ask her why? And then thereafter I advice according to what she narrates",20,2,1,1,NA,2,2,2,2,3,7,2,NA,"uuid:634031a5-1eeb-42e9-9a93-3181d6cc8a37",1611022330,"uuid:634031a5-1eeb-42e9-9a93-3181d6cc8a37",19
"179","11/29/2016 19:58","11/29/2016 9:07","11/29/2016 9:36",3,NA,NA,NA,NA,1,NA,"11/29/2016 9:07","V203021",1,48,1,NA,2,11,"I was voted to be the VHT by citizens",2,"Farming",NA,NA,NA,NA,NA,NA,NA,1,30,NA,1,2,250,NA,4,4,NA,10,"0",0,NA,NA,3,1,3,0,3,0,0,"0",0,NA,NA,NA,2,NA,"I first get the truth of the matter then I can sit with both of them and we discuss it together",24,2,1,1,NA,1,2,2,2,3,5,4,NA,"uuid:bc9da5ae-c178-44bf-bf93-7fbefb4a6bd5",1611022330,"uuid:bc9da5ae-c178-44bf-bf93-7fbefb4a6bd5",19
"180","11/29/2016 19:58","11/29/2016 9:49","11/29/2016 10:04",3,NA,NA,NA,NA,1,NA,"11/29/2016 9:49","V203022",2,50,1,NA,2,7,"I replaced the one who was the VHT and left the village",2,"Farming",NA,NA,NA,NA,NA,NA,NA,1,35,NA,1,5,250,NA,4,4,NA,20,"0",0,NA,NA,20,0,0,0,0,0,0,"0",0,NA,NA,NA,1,"Fear to loose their marriages","I visit this household and counsel the couple",22,3,1,1,NA,1,1,1,2,2,7,4,NA,"uuid:ba6940b4-6bea-41f2-a4ff-05a523842715",1611022330,"uuid:ba6940b4-6bea-41f2-a4ff-05a523842715",19
"181","11/29/2016 20:40","11/29/2016 11:51","11/29/2016 12:21",3,NA,NA,NA,NA,1,NA,"11/29/2016 11:51","V204031",2,54,1,NA,2,3,"I replaced a former VHT ",2,"Farming ",NA,NA,NA,NA,NA,NA,NA,1,10,NA,1,10,90,NA,2,3,NA,5,"0",0,NA,NA,5,0,0,0,0,0,0,"0",0,NA,NA,NA,2,NA,"I talk to them both and make sure they reach a solution to the violence ",29,2,1,1,NA,1,1,1,2,3,7,4,NA,"uuid:f7056093-8bff-43b0-9731-cd44230e70e7",1611022330,"uuid:f7056093-8bff-43b0-9731-cd44230e70e7",21
"182","11/29/2016 20:40","11/29/2016 12:31","11/29/2016 12:47",2,NA,NA,NA,NA,1,NA,"11/29/2016 12:31","V204032",1,43,1,NA,2,2,"I was elected by the village people ",2,"Farming ",NA,NA,NA,NA,NA,NA,NA,1,10,NA,1,30,180,NA,4,4,NA,0,"0",0,NA,NA,NA,NA,NA,NA,NA,NA,NA,NA,NA,NA,1,5,1,"Fear for their husbands ","I talk to the husband and advise him not to do it again",23,2,1,1,NA,1,2,1,1,3,7,1,NA,"uuid:702491a9-cf7c-4bb2-934e-783702c86cf6",1611022330,"uuid:702491a9-cf7c-4bb2-934e-783702c86cf6",21
"183","11/30/2016 17:10","11/30/2016 12:23","11/30/2016 13:02",3,NA,NA,NA,NA,1,NA,"11/30/2016 12:23","V204045",1,62,1,NA,2,6,"Village members elected me",2,"Farming",NA,NA,NA,NA,NA,NA,NA,1,10,NA,2,1,50,NA,3,4,NA,2,"0",0,NA,NA,2,0,0,0,0,0,0,"0",0,NA,NA,NA,1,"Most men  spend alot on drinking alcohol  and careless on there wives","I fast talk to the husband and hear him out before judging , then i counsel them",38,2,1,1,NA,2,2,2,1,3,8,4,NA,"uuid:85567093-4ef9-4922-a5a1-b41244c5a7f5",1611022330,"uuid:85567093-4ef9-4922-a5a1-b41244c5a7f5",22
"184","11/30/2016 19:40","11/30/2016 10:08","11/30/2016 10:44",4,NA,NA,NA,NA,1,NA,"11/30/2016 10:08","V204102",2,33,1,NA,2,5,"I was elected by the village residents",2,"She owns a hardware shop",NA,NA,NA,NA,NA,NA,NA,1,10,NA,1,30,80,NA,3,2,NA,1,"They always ask me when they will ever get water in the community",0,NA,NA,0,0,0,0,0,0,1,"0",0,NA,NA,NA,1,"She fears the fellow women in the society finding out that she was beaten","I first hear from both sides then I counsel them",16,2,1,1,NA,2,2,2,2,3,7,1,NA,"uuid:85e0edb0-31b4-4c0a-bb2f-19e2ffa2ee56",1611022330,"uuid:85e0edb0-31b4-4c0a-bb2f-19e2ffa2ee56",23
"185","11/30/2016 19:40","11/30/2016 10:58","11/30/2016 11:19",4,NA,NA,NA,NA,1,NA,"11/30/2016 10:58","V204101",2,37,1,NA,2,5,"I was elected by village residents",2,"Farmer",NA,NA,NA,NA,NA,NA,NA,1,30,NA,2,1,58,NA,3,2,NA,4,",0",0,NA,NA,3,1,0,0,0,0,0,"0",0,NA,NA,NA,1,"Sometimes she fears causing the imprisonment fir by the husband","I call both of them they I counsel the couple",37,2,1,1,NA,2,2,2,1,3,7,1,NA,"uuid:ac4776af-0e5f-4721-837a-d7e6e17e876f",1611022330,"uuid:ac4776af-0e5f-4721-837a-d7e6e17e876f",23
"186","11/30/2016 19:40","11/30/2016 11:27","11/30/2016 11:47",4,NA,NA,NA,NA,1,NA,"11/30/2016 11:28","V204103",2,50,2,NA,NA,NA,NA,NA,NA,NA,2,15,"I was elected by village residents",2,"Farmer",NA,1,20,NA,1,30,NA,NA,NA,NA,NA,3,"0",0,NA,NA,2,1,0,0,0,0,0,"0",0,NA,NA,NA,1,"She fears causing the husband more problems of being imprisoned","I counsel the couple",25,2,1,1,NA,2,2,1,1,2,7,1,NA,"uuid:8696479d-d38b-4d36-8888-8868290d0389",1611022330,"uuid:8696479d-d38b-4d36-8888-8868290d0389",23
"187","11/30/2016 19:40","11/30/2016 12:01","11/30/2016 12:17",4,NA,NA,NA,NA,1,NA,"11/30/2016 12:01","V204104",1,48,1,NA,2,5,"I was elected by the village residents",2,"Farmer",NA,NA,NA,NA,NA,NA,NA,1,10,NA,1,30,48,NA,3,2,NA,0,"0",0,NA,NA,NA,NA,NA,NA,NA,NA,NA,NA,NA,NA,2,NA,2,NA,"I ask her as to why she was beaten then I counsel the couple",45,1,1,1,NA,2,2,2,2,3,7,2,NA,"uuid:2062ec95-4a05-4247-be6b-7f450509aa51",1611022330,"uuid:2062ec95-4a05-4247-be6b-7f450509aa51",23
"188","11/30/2016 19:40","11/30/2016 15:02","11/30/2016 15:25",4,NA,NA,NA,NA,1,NA,"11/30/2016 15:02","V204105",2,59,1,NA,2,5,"I was elected by the village residents",2,"Farmer",NA,NA,NA,NA,NA,NA,NA,1,15,NA,1,40,200,NA,3,1,NA,0,"0",0,NA,NA,NA,NA,NA,NA,NA,NA,NA,NA,NA,NA,1,2,1,"They fear exposing their family matters in public","I sit her down and ask her why she was beaten then I counsel her",50,3,1,1,NA,2,4,2,1,3,6,1,NA,"uuid:464480e7-3eb5-42cc-aa7e-3a9101a4a630",1611022330,"uuid:464480e7-3eb5-42cc-aa7e-3a9101a4a630",23
"189","11/30/2016 19:40","11/30/2016 16:04","11/30/2016 16:23",4,NA,NA,NA,NA,1,NA,"11/30/2016 16:05","V204106",2,27,1,NA,2,5,"I was appointed by the prison commissioner",2,"Works as assistant matron in prison's department",NA,NA,NA,NA,NA,NA,NA,1,20,NA,1,45,25,NA,3,1,NA,2,"0",0,NA,NA,2,0,0,0,0,0,0,"0",0,NA,NA,NA,1,"They fear being a shame in the village","I advise her t first talk to her aunties and uncles",1,3,1,1,NA,2,4,1,1,3,6,1,NA,"uuid:bc413606-7354-4960-8eee-b931459808c9",1611022330,"uuid:bc413606-7354-4960-8eee-b931459808c9",23
"190","11/30/2016 20:27","11/30/2016 16:24","11/30/2016 16:38",2,NA,NA,NA,NA,1,NA,"11/30/2016 16:24","v205172",2,43,1,NA,2,6,"I was appointed by the chairman of the village ",2,"farming and poultry ",NA,NA,NA,NA,NA,NA,NA,1,2,NA,1,30,99,NA,3,1,NA,1,"ARTs",5,NA,NA,1,0,0,0,0,0,0,"0",0,NA,NA,NA,2,NA,"I would first talk to both patters to find out the cause of the trouble ",20,2,1,1,NA,1,4,2,2,3,7,4,NA,"uuid:f9c27118-9392-4267-a374-51eee976df61",1611022330,"uuid:f9c27118-9392-4267-a374-51eee976df61",30
"191","11/30/2016 20:28","11/30/2016 17:04","11/30/2016 17:13",2,NA,NA,NA,NA,1,NA,"11/30/2016 17:04","v205173",1,64,1,NA,2,5,"I was appointed by the people",2,"farming",NA,NA,NA,NA,NA,NA,NA,1,30,NA,1,30,134,NA,3,2,NA,3,"0",0,NA,NA,3,0,0,0,0,0,0,"0",0,NA,NA,NA,2,NA,"I offer counselling and if that fails I refer the matter to the police ",64,1,1,1,NA,1,2,2,2,3,8,4,NA,"uuid:0794169d-5379-4c00-8e08-27f29455a73a",1611022330,"uuid:0794169d-5379-4c00-8e08-27f29455a73a",30
"192","11/30/2016 20:32","11/30/2016 16:02","11/30/2016 16:21",2,NA,NA,NA,NA,1,NA,"11/30/2016 16:02","v205171",1,67,1,NA,2,11,"I volunteered myself to work ",2,"farming and poultry ",NA,NA,NA,NA,NA,NA,NA,1,10,NA,1,30,125,NA,3,1,NA,0,"0",0,NA,NA,NA,NA,NA,NA,NA,NA,NA,NA,NA,NA,2,NA,2,NA,"I offer guidance and councelling ",67,1,1,1,NA,1,4,2,2,2,7,4,NA,"uuid:a7476879-0b4d-42dd-a9a6-ebfe4732cdce",1611022330,"uuid:a7476879-0b4d-42dd-a9a6-ebfe4732cdce",30
"193","11/30/2016 20:41","11/30/2016 15:07","11/30/2016 15:21",3,NA,NA,NA,NA,1,NA,"11/30/2016 15:06","V205143",2,48,2,NA,NA,NA,NA,NA,NA,NA,2,7,"I was voted by people",2,"Farming",NA,1,45,NA,1,5,NA,NA,NA,NA,NA,3,"0",0,NA,NA,3,0,0,0,0,0,0,"0",0,NA,NA,NA,2,NA,"I first ask what could be the reason why she is beaten then I can counsel them together",20,2,1,1,NA,1,1,1,1,3,7,1,NA,"uuid:057076a5-9a39-4340-b506-9cf15c8bf712",1611022330,"uuid:057076a5-9a39-4340-b506-9cf15c8bf712",27
"194","11/30/2016 20:41","11/30/2016 14:12","11/30/2016 14:30",3,NA,NA,NA,NA,1,NA,"11/30/2016 14:12","V205142",1,49,1,NA,2,6,"I was voted by people",2,"Farming",NA,NA,NA,NA,NA,NA,NA,1,5,NA,1,5,120,NA,4,5,NA,9,"0",0,NA,NA,9,0,0,0,0,0,0,"0",0,NA,NA,NA,2,NA,"I first meet both of them and understand the truth of the mater",49,2,1,1,NA,1,2,1,2,3,7,4,NA,"uuid:f1652b96-a270-4aa4-a629-e43347a20719",1611022330,"uuid:f1652b96-a270-4aa4-a629-e43347a20719",27
"195","12/1/2016 19:40","11/28/2016 11:20","11/28/2016 11:49",3,NA,NA,NA,NA,1,NA,"11/28/2016 11:21","V205051",2,51,1,NA,2,10,"I was voted to be the VHT by people",2,"Tailor",NA,NA,NA,NA,NA,NA,NA,1,30,NA,1,30,800,NA,4,3,NA,2,"0",0,NA,NA,2,0,0,0,0,0,0,"0",0,NA,NA,NA,2,NA,"I call both of them and counsel them",21,2,1,2,NA,1,2,1,1,3,7,1,NA,"uuid:949a33ff-ed5c-4cdc-b18b-310b871c654f",1611022330,"uuid:949a33ff-ed5c-4cdc-b18b-310b871c654f",25
"196","12/1/2016 19:40","11/28/2016 11:58","11/28/2016 12:24",3,NA,NA,NA,NA,1,NA,"11/28/2016 11:58","V205052",2,44,1,NA,2,10,"The chairman asked for volunteers and I joined",2,"Business",NA,NA,NA,NA,NA,NA,NA,1,45,NA,1,60,800,NA,4,3,NA,1,"0",0,NA,NA,1,0,0,0,0,0,0,"0",0,NA,NA,NA,2,NA,"I first ask for the reason why she is being beaten and then visit the household and ask the husband",20,2,1,1,NA,1,1,1,1,3,7,4,NA,"uuid:f688afdb-fa68-40a5-bb8d-67ef9f862b9f",1611022330,"uuid:f688afdb-fa68-40a5-bb8d-67ef9f862b9f",25
"197","12/1/2016 19:40","11/28/2016 12:35","11/28/2016 12:58",3,NA,NA,NA,NA,1,NA,"11/28/2016 12:35","V205053",2,42,2,NA,NA,NA,NA,NA,NA,NA,2,10,"I was voted by people",1,"Business",NA,1,30,NA,1,30,NA,NA,NA,NA,NA,2,"0",0,NA,NA,2,0,0,0,0,0,0,"0",0,NA,NA,NA,2,NA,"I go and talk to both of them",25,2,1,1,NA,1,1,1,1,3,7,4,NA,"uuid:4885a7b6-8c66-4c8c-b8a6-373362f024c5",1611022330,"uuid:4885a7b6-8c66-4c8c-b8a6-373362f024c5",25
"198","12/1/2016 19:40","12/1/2016 15:20","12/1/2016 16:13",3,NA,NA,NA,NA,1,NA,"12/1/2016 15:21","V202122",2,42,1,NA,2,5,"After being trained in Naluzaale",2,"Farming and brewery",NA,NA,NA,NA,NA,NA,NA,2,1,NA,2,2,57,NA,2,1,NA,0,"Everyday life like how to survive economically",0,NA,NA,NA,NA,NA,NA,NA,NA,NA,NA,NA,NA,1,1,2,NA,"I would tell her to change her ways and please her husband",42,2,1,1,NA,2,1,2,1,3,5,1,NA,"uuid:115b991b-48f0-470f-97ca-dfef3e94aa3a",1611022330,"uuid:115b991b-48f0-470f-97ca-dfef3e94aa3a",18
"199","12/1/2016 19:48","12/1/2016 15:40","12/1/2016 16:00",3,NA,NA,NA,NA,1,NA,"12/1/2016 15:40","V202123",2,61,2,NA,NA,NA,NA,NA,NA,NA,2,20,"We were elected ",2,"Farming",NA,2,1,NA,2,2,NA,NA,NA,NA,NA,5,"Fathers deny school to their children ",3,NA,NA,4,1,0,0,0,0,0,"0",0,NA,NA,NA,1,"Sometimes the man refuses to give her money and the woman too does it have money. ","I first call Borg couples and listen to them ",61,2,1,1,NA,2,2,NA,2,2,6,1,NA,"uuid:e14fb907-be90-49f5-93f9-a93f3ba4b07d",1611022330,"uuid:e14fb907-be90-49f5-93f9-a93f3ba4b07d",18
"200","12/1/2016 20:12","12/1/2016 11:18","12/1/2016 11:29",4,NA,NA,NA,NA,1,NA,"12/1/2016 11:18","Vwweerr",2,47,2,NA,NA,NA,NA,NA,NA,NA,2,2,"I was elected by village residents",2,"She operates a shop",NA,1,15,NA,1,30,NA,NA,NA,NA,NA,0,"0",0,NA,NA,NA,NA,NA,NA,NA,NA,NA,NA,NA,NA,1,3,2,NA,"I first ask her why she was beaten then I counsel both of them",30,3,1,1,NA,2,2,NA,1,3,7,1,NA,"uuid:0036960a-7d7d-4353-8337-28fc4f9ae6ea",1611022330,"uuid:0036960a-7d7d-4353-8337-28fc4f9ae6ea",20
"201","12/1/2016 20:12","12/1/2016 9:53","12/1/2016 10:16",4,NA,NA,NA,NA,1,NA,"12/1/2016 9:53","V203111",1,60,1,NA,2,4,"I was appointed by the village local council committee",2,"He has a vegetable and fruits shop he operates",NA,NA,NA,NA,NA,NA,NA,1,2,NA,1,5,300,NA,3,1,NA,4,"0",0,NA,NA,2,2,0,0,0,0,0,"0",0,NA,NA,NA,1,"They fear causing imprisonment for their husbands","I first ask her to obey her husband always",30,2,2,1,NA,2,1,1,2,3,7,1,NA,"uuid:58c937e2-63a5-43db-9571-098282632bd7",1611022330,"uuid:58c937e2-63a5-43db-9571-098282632bd7",20
"202","12/1/2016 20:30","12/1/2016 11:43","12/1/2016 12:00",2,NA,NA,NA,NA,1,NA,"12/1/2016 11:43","V204133",2,50,1,NA,2,5,"Chairman called for a village meeting and he requested people to voted for four VHTs, and i happened to be part",2,"Farming",NA,NA,NA,NA,NA,NA,NA,1,20,NA,1,30,31,NA,4,3,NA,4,"0",0,NA,NA,4,0,0,0,0,0,0,"0",0,NA,NA,NA,2,NA,"I report the case to the chairman LC1",21,2,1,1,NA,2,2,2,1,3,7,1,NA,"uuid:f898671b-41c4-4d0d-9ee7-95d9e3590835",1611022330,"uuid:f898671b-41c4-4d0d-9ee7-95d9e3590835",24
"203","12/2/2016 7:23","12/1/2016 11:44","12/1/2016 12:09",2,NA,NA,NA,NA,1,NA,"12/1/2016 11:44","v204132",2,30,1,NA,2,2,"I was elected by the people ",1,"retail in food stuffs",NA,NA,NA,NA,NA,NA,NA,1,15,NA,2,1,108,NA,3,1,NA,0,"0",0,NA,NA,NA,NA,NA,NA,NA,NA,NA,NA,NA,NA,1,1,2,NA,"I tell her to report the case to the subcounty ",9,2,1,1,NA,1,4,1,1,2,4,1,NA,"uuid:6174add9-021d-46b4-b076-bba65c6235c0",1611022330,"uuid:6174add9-021d-46b4-b076-bba65c6235c0",24
"204","12/2/2016 7:23","12/1/2016 10:58","12/1/2016 11:23",2,NA,NA,NA,NA,1,NA,"12/1/2016 10:59","v204131",2,61,2,NA,NA,NA,NA,NA,NA,NA,2,10,"I was elected bye the people ",2,"farming ",NA,1,20,NA,2,1,NA,NA,NA,NA,NA,0,"0",0,NA,NA,NA,NA,NA,NA,NA,NA,NA,NA,NA,NA,1,7,1,"lack of money for transport and treatment ","I first ask her why she thinks the husband is beating her and if the reason is compelling enough then I advise her to improve on her behaviour ",22,2,1,1,NA,1,4,2,1,3,8,4,NA,"uuid:7a4237fc-6ea7-4d3a-929d-1ad09904e31d",1611022330,"uuid:7a4237fc-6ea7-4d3a-929d-1ad09904e31d",24
