"48","Oct 29, 2016 7:00:49 PM","Oct 29, 2016 10:18:59 AM","Oct 29, 2016 10:45:04 AM",4,NA,NA,NA,NA,1,NA,"Oct 29, 2016 10:19:00 AM","V416131",2,50,2,NA,NA,NA,NA,NA,NA,NA,2,15,"I was elected by village residents",2,"Farming",NA,1,10,NA,1,15,NA,NA,4,20,NA,3,"0",0,NA,NA,3,0,0,0,0,0,0,0,0,NA,NA,NA,2,NA,"I counsel them",25,3,1,1,NA,1,2,NA,2,3,7,2,NA,"uuid:dacf972e-b3df-4022-a6a5-9fd713ecb57b",1610200721,"uuid:dacf972e-b3df-4022-a6a5-9fd713ecb57b",95
"49","Oct 29, 2016 7:00:50 PM","Oct 29, 2016 12:14:31 PM","Oct 29, 2016 12:34:52 PM",4,NA,NA,NA,NA,1,NA,"Oct 29, 2016 12:14:00 PM","V416132",2,50,1,NA,2,5,"I was chosen by the village residents",2,"Farmer",NA,NA,NA,NA,NA,NA,NA,1,30,NA,1,20,150,NA,3,1,NA,0,"0",0,NA,NA,NA,NA,NA,NA,NA,NA,NA,NA,NA,NA,1,1,1,"She fears the husband being imprisoned","I hear both sides of the story and see how we can solve the issue in harmony",27,2,1,1,NA,1,2,2,NA,2,7,3,NA,"uuid:71d39d8d-b7e7-409d-89cf-f4efdb50b545",1610200721,"uuid:71d39d8d-b7e7-409d-89cf-f4efdb50b545",95
"50","Oct 29, 2016 7:00:50 PM","Oct 29, 2016 12:47:47 PM","Oct 29, 2016 1:04:10 PM",4,NA,NA,NA,NA,1,NA,"Oct 29, 2016 12:47:00 PM","V416133",2,52,1,NA,2,5,"She was called up by a health organization to be among the VHTs",2,"Farmer",NA,NA,NA,NA,NA,NA,NA,2,1,NA,1,10,45,NA,3,1,NA,0,"0",0,NA,NA,NA,NA,NA,NA,NA,NA,NA,NA,NA,NA,2,NA,1,"She fears spoiling her marriage","I call up for a woman council in the village and discuss all the issues",26,2,1,1,NA,1,2,NA,1,2,7,1,NA,"uuid:0d4df3e4-3dd4-4397-9c76-acd6be8be75c",1610200721,"uuid:0d4df3e4-3dd4-4397-9c76-acd6be8be75c",95
"51","Oct 29, 2016 7:44:29 PM","Oct 29, 2016 12:51:43 PM","Oct 29, 2016 1:38:26 PM",3,NA,NA,NA,NA,1,NA,"Oct 29, 2016 1:10:00 PM","V416011",1,24,1,NA,2,7,"I was selected by the chairman",2,"Teaching and farming",NA,NA,NA,NA,NA,NA,NA,1,20,NA,1,40,120,NA,3,1,NA,5,"0",0,NA,NA,5,0,0,0,0,0,0,0,0,NA,NA,NA,1,"Bruises that develop into serious wounds","I take her to LC1 committee",15,2,1,1,NA,2,1,1,1,3,7,1,NA,"uuid:33ae0666-003f-4446-a10a-674181ff5fbc",1610200721,"uuid:33ae0666-003f-4446-a10a-674181ff5fbc",83
"52","Oct 29, 2016 8:01:18 PM","Oct 29, 2016 10:04:41 AM","Oct 29, 2016 12:02:36 PM",2,NA,NA,NA,NA,1,NA,"Oct 29, 2016 10:05:00 AM","V405431",2,59,2,NA,NA,NA,NA,NA,NA,NA,2,10,"I was elected by the people",2,"Farming",NA,1,5,NA,1,10,NA,NA,4,4,NA,0,"0",0,NA,NA,NA,NA,NA,NA,NA,NA,NA,NA,NA,NA,2,NA,2,NA,"I offer counseling to the couple",44,1,2,1,NA,1,2,1,2,2,7,4,NA,"uuid:b2caa2fa-51b3-4550-a9ab-5b190cc2c063",1610200721,"uuid:b2caa2fa-51b3-4550-a9ab-5b190cc2c063",87
"53","Oct 29, 2016 8:01:18 PM","Oct 29, 2016 11:30:05 AM","Oct 29, 2016 12:01:23 PM",2,NA,NA,NA,NA,1,NA,"Oct 29, 2016 11:32:00 AM","V405432",1,56,1,NA,2,10,"I was appointed by the LC1 chairperson but elected by the people",2,"Farming",NA,NA,NA,NA,NA,NA,NA,1,20,NA,1,30,100,NA,3,4,NA,0,"0",0,NA,NA,NA,NA,NA,NA,NA,NA,NA,NA,NA,NA,2,NA,2,NA,"I advise her to see a probation officer",56,2,1,1,NA,1,2,2,1,3,7,1,NA,"uuid:73452f00-1b30-428a-8e3a-78c57c2669ce",1610200721,"uuid:73452f00-1b30-428a-8e3a-78c57c2669ce",87
"54","Oct 29, 2016 8:01:18 PM","Oct 29, 2016 2:58:13 PM","Oct 29, 2016 3:22:27 PM",2,NA,NA,NA,NA,1,NA,"Oct 29, 2016 2:58:00 PM","V405433",2,28,1,NA,2,3,"I was advised to volunteer by another VHT",2,"Farming, runs a retail shop",NA,NA,NA,NA,NA,NA,NA,1,10,NA,1,20,120,NA,3,4,NA,0,"0",0,NA,NA,NA,NA,NA,NA,NA,NA,NA,NA,NA,NA,2,NA,2,NA,"I tell her to talk to the nabakyala",3,2,1,1,NA,1,2,1,1,4,7,1,NA,"uuid:e7956da0-325c-45c2-8791-5e49102e267c",1610200721,"uuid:e7956da0-325c-45c2-8791-5e49102e267c",87
"55","Oct 29, 2016 8:01:19 PM","Oct 29, 2016 3:23:51 PM","Oct 29, 2016 3:50:40 PM",2,NA,NA,NA,NA,1,NA,"Oct 29, 2016 3:24:00 PM","V405434",2,58,2,NA,NA,NA,NA,NA,NA,NA,2,8,"I was elected by the people",2,"Farming",NA,1,10,NA,1,30,NA,NA,3,1,NA,2,"0",0,NA,NA,1,1,0,0,0,0,0,0,0,NA,NA,NA,2,NA,"I tell her that she needs to be strong and patient in marriage, she needs to forgive and repair her relationship",43,2,1,1,NA,1,2,1,2,3,8,NA,NA,"uuid:99b0fafa-a9ee-4743-8962-b61e240f0db5",1610200721,"uuid:99b0fafa-a9ee-4743-8962-b61e240f0db5",87
"56","Oct 29, 2016 8:01:19 PM","Oct 29, 2016 4:44:20 PM","Oct 29, 2016 5:02:34 PM",2,NA,NA,NA,NA,1,NA,"Oct 29, 2016 4:45:00 PM","V405434",1,41,1,NA,2,5,"I was appointed by the chairperson LC1",2,"Farming",NA,NA,NA,NA,NA,NA,NA,1,20,NA,1,30,150,NA,3,1,NA,0,"0",0,NA,NA,NA,NA,NA,NA,NA,NA,NA,NA,NA,NA,2,NA,2,NA,"I send her to go see the nabakyala",27,2,1,1,NA,1,2,2,1,3,3,1,NA,"uuid:b821747a-0b65-404d-bae3-f5dc50b08160",1610200721,"uuid:b821747a-0b65-404d-bae3-f5dc50b08160",87
"57","Oct 31, 2016 7:59:12 PM","Oct 31, 2016 4:22:47 PM","Oct 31, 2016 4:57:50 PM",3,NA,NA,NA,NA,1,NA,"Oct 31, 2016 4:32:00 PM","V416232",2,36,1,NA,2,6,"I was called by my pastor saying I was needed needed in a seminar that took two weeks and when we came back they told us we shall be working as VHTs",2,"Teaching",NA,NA,NA,NA,NA,NA,NA,2,2,NA,1,30,150,NA,2,1,NA,0,"0",0,NA,NA,NA,NA,NA,NA,NA,NA,NA,NA,NA,NA,2,NA,1,"They fear to tell us ","I counsel her with the husband",20,2,1,1,NA,2,1,NA,1,3,7,4,NA,"uuid:a45d1edc-25e0-4302-a2e0-2447232b996f",1610200721,"uuid:a45d1edc-25e0-4302-a2e0-2447232b996f",96
"58","Oct 31, 2016 7:59:12 PM","Oct 31, 2016 3:35:46 PM","Oct 31, 2016 4:09:47 PM",3,NA,NA,NA,NA,1,NA,"Oct 31, 2016 3:50:00 PM","V416231",1,45,1,NA,2,10,"I was voted by village members",1,"Farming",NA,NA,NA,NA,NA,NA,NA,1,30,NA,2,1,150,NA,3,1,NA,0,"0",0,NA,NA,NA,NA,NA,NA,NA,NA,NA,NA,NA,NA,1,2,1,"Lack of information","I first send her to nabakyala",21,2,1,1,NA,2,2,1,1,3,7,1,NA,"uuid:fb4461b0-1b7c-4176-abbd-21cca5f7a9b1",1610200721,"uuid:fb4461b0-1b7c-4176-abbd-21cca5f7a9b1",96
"59","Oct 31, 2016 7:59:12 PM","Oct 31, 2016 6:34:31 PM","Oct 31, 2016 7:14:00 PM",3,NA,NA,NA,NA,1,NA,"Oct 31, 2016 6:52:00 PM","V416234",1,38,1,NA,2,12,"I was selected by the in charge of the health center III",2,"Farming",NA,NA,NA,NA,NA,NA,NA,1,30,NA,1,15,30,NA,3,1,NA,1,"0",0,NA,NA,0,0,0,0,1,0,0,0,0,NA,NA,NA,2,NA,"I tell her to look for elders and intervene",35,2,1,1,NA,2,2,1,1,3,6,1,NA,"uuid:2b2b6020-45d6-4ccf-bacc-8adf1cd1e523",1610200721,"uuid:2b2b6020-45d6-4ccf-bacc-8adf1cd1e523",96
"60","Oct 31, 2016 8:01:24 PM","Oct 31, 2016 2:59:37 PM","Oct 31, 2016 3:10:56 PM",2,NA,NA,NA,NA,1,NA,"Oct 31, 2016 2:59:00 PM","V416101",2,54,2,NA,NA,NA,NA,NA,NA,NA,2,6,"I was elected by the people",2,"Farming",NA,1,20,NA,1,40,NA,NA,3,0,NA,3,"0",0,NA,NA,2,1,0,0,0,0,0,0,0,NA,NA,NA,2,NA,"I ask her what she thinks is the cause of the violence, I then contact the husband to get his side of the story",30,2,1,1,NA,1,2,1,1,3,8,4,NA,"uuid:9235e918-9f72-47b6-9cbb-8b133dea9763",1610200721,"uuid:9235e918-9f72-47b6-9cbb-8b133dea9763",94
"61","Oct 31, 2016 8:06:20 PM","Oct 31, 2016 9:34:33 AM","Oct 31, 2016 10:11:25 AM",4,NA,NA,NA,NA,1,NA,"Oct 31, 2016 9:34:00 AM","V413371",2,34,1,NA,2,5,"I was called  by the subcounty officials",2,"Tailoring",NA,NA,NA,NA,NA,NA,NA,2,1,NA,1,30,400,NA,3,1,NA,3,"0",0,NA,NA,3,0,0,0,0,0,0,0,0,NA,NA,NA,1,"Most ladies are very poor and they fear the husbands being imprisoned if they report","I ask her if I would speak to the husband on her behalf",16,2,1,1,NA,2,1,1,NA,3,5,1,NA,"uuid:071e93d0-4144-46ee-88b8-4e6b82928b26",1610200721,"uuid:071e93d0-4144-46ee-88b8-4e6b82928b26",81
"62","Oct 31, 2016 8:06:42 PM","Oct 31, 2016 3:38:46 PM","Oct 31, 2016 4:10:21 PM",4,NA,NA,NA,NA,1,NA,"Oct 31, 2016 3:39:00 PM","V413371",2,40,2,NA,NA,NA,NA,NA,NA,NA,1,8,"I replaced the Nabakyala who left the area because was her vice",2,"Farmer",NA,2,1,NA,2,1,NA,NA,2,5,NA,15,"0",0,NA,NA,14,1,0,0,0,0,0,0,0,NA,NA,NA,1,"Sometimes they lack money for the hospital bills","I call them up for a counseling meeting",13,2,1,1,NA,1,2,1,1,3,8,1,NA,"uuid:22b693bf-bdec-49fa-a5ca-ba75d20cdb9d",1610200721,"uuid:22b693bf-bdec-49fa-a5ca-ba75d20cdb9d",81
"63","Nov 1, 2016 8:47:08 PM","Nov 1, 2016 5:15:36 PM","Nov 1, 2016 5:37:05 PM",3,NA,NA,NA,NA,1,NA,"Nov 1, 2016 5:19:00 PM","V410063",1,26,1,NA,2,5,"I was selected for training",2,"Farming",NA,NA,NA,NA,NA,NA,NA,2,1,NA,1,30,100,NA,4,5,NA,0,"0",0,NA,NA,NA,NA,NA,NA,NA,NA,NA,NA,NA,NA,1,4,1,"Fear not to helped","I counsel the husband",26,2,1,1,NA,2,1,2,2,2,5,1,NA,"uuid:26f4dae2-f6d5-4eb4-b5bf-514c10ccfe72",1610200721,"uuid:26f4dae2-f6d5-4eb4-b5bf-514c10ccfe72",66
"64","Nov 1, 2016 8:47:19 PM","Nov 1, 2016 5:44:29 PM","Nov 1, 2016 6:06:00 PM",3,NA,NA,NA,NA,1,NA,"Nov 1, 2016 5:48:00 PM","V410062",2,27,1,NA,2,8,"I was selected by the village committee",2,"Farming",NA,NA,NA,NA,NA,NA,NA,2,2,NA,1,10,10,NA,3,1,NA,10,"0",0,NA,NA,9,1,0,0,0,0,0,0,0,NA,NA,NA,1,"Fear to divorce","I call his husband and her for counseling or send them to police",27,2,1,1,NA,2,1,1,2,2,7,4,NA,"uuid:bc3e2a2d-6c57-46a2-98fa-c188c273d6f5",1610200721,"uuid:bc3e2a2d-6c57-46a2-98fa-c188c273d6f5",66
"65","Nov 1, 2016 8:50:26 PM","Nov 1, 2016 4:27:31 PM","Nov 1, 2016 4:44:17 PM",4,NA,NA,NA,NA,1,NA,"Nov 1, 2016 4:27:00 PM","V403281",1,39,1,NA,2,1,"I was called up by a health organization and qualified",2,"Carpenter",NA,NA,NA,NA,NA,NA,NA,1,40,NA,2,1.5,110,NA,3,6,NA,0,"0",0,NA,NA,NA,NA,NA,NA,NA,NA,NA,NA,NA,NA,2,NA,2,NA,"I refer her to the subcounty chief in charge of families",7,3,1,1,NA,2,1,1,1,3,5,2,NA,"uuid:4c8015d2-5d93-4c87-88b7-dde962632e84",1610200721,"uuid:4c8015d2-5d93-4c87-88b7-dde962632e84",65
"66","Nov 1, 2016 8:50:35 PM","Nov 1, 2016 5:25:40 PM","Nov 1, 2016 6:03:36 PM",4,NA,NA,NA,NA,1,NA,"Nov 1, 2016 5:25:00 PM","V403282",2,22,1,NA,2,1,"I was invited for a seminar of a health organization and I was made one",2,"She owns a bar",NA,NA,NA,NA,NA,NA,NA,1,30,NA,2,1,40,NA,3,2,NA,0,"0",0,NA,NA,NA,NA,NA,NA,NA,NA,NA,NA,NA,NA,1,3,1,"She fears the repercussions that might come up after going to the hospital on the side of the husband","I first find out the cause of the whole bad situation happening then I counsel them",22,2,1,1,NA,1,4,NA,2,2,6,1,NA,"uuid:405ae1df-0fa9-443c-a1a7-f127844b8776",1610200721,"uuid:405ae1df-0fa9-443c-a1a7-f127844b8776",65
"67","Nov 1, 2016 8:50:44 PM","Nov 1, 2016 6:12:43 PM","Nov 1, 2016 6:27:18 PM",4,NA,NA,NA,NA,1,NA,"Nov 1, 2016 6:12:00 PM","V403283",1,51,1,NA,2,5,"I was elected by the residents of my village",2,"Farmer",NA,NA,NA,NA,NA,NA,NA,1,30,NA,2,1,40,NA,3,4,NA,0,"0",0,NA,NA,NA,NA,NA,NA,NA,NA,NA,NA,NA,NA,1,2,2,NA,"I counsel such a couple",51,3,1,1,NA,2,1,NA,1,3,6,1,NA,"uuid:e477e09a-0434-4cd8-a885-da727bc5f5a1",1610200721,"uuid:e477e09a-0434-4cd8-a885-da727bc5f5a1",65
"68","Nov 1, 2016 9:32:09 PM","Nov 1, 2016 5:14:43 PM","Nov 1, 2016 5:34:13 PM",2,NA,NA,NA,NA,1,NA,"Nov 1, 2016 5:15:00 PM","V403461",2,40,1,NA,2,1,"I volunteered at the hospital",1,"Farming",NA,NA,NA,NA,NA,NA,NA,1,10,NA,2,2,30,NA,3,1,NA,10,"0",0,NA,NA,10,0,0,0,0,0,0,0,0,NA,NA,NA,2,NA,"I offer some advise about marriage and relationships",12,3,1,1,NA,1,2,1,1,3,7,4,NA,"uuid:0dc2d458-f967-40ee-8bc8-d664a2199f33",1610200721,"uuid:0dc2d458-f967-40ee-8bc8-d664a2199f33",68
"69","Nov 2, 2016 7:18:39 PM","Nov 2, 2016 12:35:38 PM","Nov 2, 2016 2:05:33 PM",3,NA,NA,NA,NA,1,NA,"Nov 2, 2016 12:36:00 PM","V403294",2,50,1,NA,2,3,"2013",1,"Sells shoes",NA,NA,NA,NA,NA,NA,NA,2,1,NA,2,1,15,NA,3,1,NA,1,"0",0,NA,NA,1,0,0,0,0,0,0,0,0,NA,NA,NA,1,"Poverty ( financial problems)","I would advise her to talk to the husbands relatives or close friends about it but he continues beating her , i would then tell  her to go back to her home village for a while.",20,2,1,1,NA,2,1,1,1,3,8,4,NA,"uuid:f3e0b4f7-428d-4b00-8862-0f13daf2b129",1610260957,"uuid:f3e0b4f7-428d-4b00-8862-0f13daf2b129",66
"70","Nov 2, 2016 7:18:46 PM","Nov 2, 2016 2:43:49 PM","Nov 2, 2016 4:42:19 PM",3,NA,NA,NA,NA,1,NA,"Nov 2, 2016 2:43:00 PM","V403293",1,51,1,NA,2,5,"2011",1,"Farmer",NA,NA,NA,NA,NA,NA,NA,2,1,NA,2,1,100,NA,2,2,NA,12,"School children drop out",0,NA,NA,8,0,4,0,0,0,0,0,0,NA,NA,NA,2,NA,"I would tell her to report the case to police",25,2,2,1,NA,1,2,1,1,3,8,4,NA,"uuid:9ca4b093-8cf3-4053-b062-bee645be2d67",1610260957,"uuid:9ca4b093-8cf3-4053-b062-bee645be2d67",66
"71","Nov 2, 2016 7:25:46 PM","Nov 2, 2016 12:13:40 PM","Nov 2, 2016 12:33:14 PM",4,NA,NA,NA,NA,1,NA,"Nov 2, 2016 12:13:00 PM","V413442",1,26,1,NA,2,5,"I was chosen by the village residents",2,"Farmer and mending shoes",NA,NA,NA,NA,NA,NA,NA,2,1,NA,1,5,95,NA,3,2,NA,1,"0",0,NA,NA,1,0,0,0,0,0,0,0,0,NA,NA,NA,2,NA,"I send her to the councilor in charge of ladies issues",26,2,1,1,NA,1,1,2,1,3,7,1,NA,"uuid:f53bdb90-e37b-438a-93c1-da001f81f3a1",1610200721,"uuid:f53bdb90-e37b-438a-93c1-da001f81f3a1",82
"72","Nov 2, 2016 7:25:45 PM","Nov 2, 2016 11:15:52 AM","Nov 2, 2016 11:40:47 AM",4,NA,NA,NA,NA,1,NA,"Nov 2, 2016 11:16:00 AM","V413441",1,53,1,NA,2,5,"I was elected by Chairman",2,"Farmer",NA,NA,NA,NA,NA,NA,NA,1,40,NA,1,10,200,NA,3,1,NA,0,"0",0,NA,NA,NA,NA,NA,NA,NA,NA,NA,NA,NA,NA,1,5,1,"She fears being beaten even more badly","I confront the husband and try counseling him",53,2,1,1,NA,2,2,NA,1,3,7,1,NA,"uuid:9474b785-1eb5-4225-9a80-10b736511a57",1610200721,"uuid:9474b785-1eb5-4225-9a80-10b736511a57",82
"73","Nov 2, 2016 7:25:46 PM","Nov 2, 2016 1:32:06 PM","Nov 2, 2016 1:52:05 PM",4,NA,NA,NA,NA,1,NA,"Nov 2, 2016 1:32:00 PM","V413442",2,52,2,NA,NA,NA,NA,NA,NA,NA,2,15,"I was elected by residents of my village",2,"Farmer",NA,1,30,NA,1,5,NA,NA,2,2,NA,1,"0",0,NA,NA,0,0,0,1,0,0,0,0,0,NA,NA,NA,1,"The wives fear their husbands being imprisoned hence causing more problems in the home","I ask for the cause,then I counsel them",25,2,1,1,NA,2,2,1,1,3,7,NA,NA,"uuid:d9836322-6106-450d-bade-6bb867ec5db6",1610200721,"uuid:d9836322-6106-450d-bade-6bb867ec5db6",82
"74","Nov 2, 2016 7:49:00 PM","Nov 2, 2016 5:07:52 PM","Nov 2, 2016 5:21:45 PM",2,NA,NA,NA,NA,1,NA,"Nov 2, 2016 5:08:00 PM","V403462",2,42,2,NA,NA,NA,NA,NA,NA,NA,1,8,"I was elected by the people",2,"Farming, also owns a retail shop",NA,1,45,NA,1,45,NA,NA,3,0,NA,2,"0",0,NA,NA,2,0,0,0,0,0,0,0,0,NA,NA,NA,2,NA,"I talk to both her and the husband to try to find the cause of the problem",37,1,1,1,NA,1,2,1,2,3,6,1,NA,"uuid:c24adbad-69e3-4230-ab00-85e22b8ee706",1610200721,"uuid:c24adbad-69e3-4230-ab00-85e22b8ee706",67
"75","Nov 2, 2016 7:49:15 PM","Nov 2, 2016 5:49:58 PM","Nov 2, 2016 6:06:55 PM",2,NA,NA,NA,NA,1,NA,"Nov 2, 2016 5:50:00 PM","V403463",1,54,1,NA,2,15,"I was elected by the village people",2,"Farming",NA,NA,NA,NA,NA,NA,NA,1,10,NA,1,10,124,NA,1,1,NA,7,"0",0,NA,NA,7,0,0,0,0,0,0,0,0,NA,NA,NA,2,NA,"I call them both and counsel them",52,2,1,1,NA,NA,2,2,1,3,7,2,NA,"uuid:64ad9964-c910-4dfd-b7d5-78f550affd61",1610200721,"uuid:64ad9964-c910-4dfd-b7d5-78f550affd61",67
"76","Nov 2, 2016 9:47:44 PM","Nov 2, 2016 12:37:16 PM","Nov 2, 2016 1:04:40 PM",3,NA,NA,NA,NA,1,NA,"Nov 2, 2016 12:42:00 PM","V411042",2,39,1,NA,2,10,"I was selected by the doctor to train for the VHT",2,"Farming",NA,NA,NA,NA,NA,NA,NA,2,1,NA,2,3,120,NA,3,1,NA,10,"0",0,NA,NA,10,0,0,0,0,0,0,0,0,NA,NA,NA,2,NA,"I ask her what the reason is and then I can start from there",20,2,1,1,NA,2,1,2,1,NA,7,4,NA,"uuid:b2ad80b3-08ef-4514-ba01-6531ecef3602",1610200721,"uuid:b2ad80b3-08ef-4514-ba01-6531ecef3602",61
"77","Nov 2, 2016 9:47:43 PM","Nov 2, 2016 11:30:20 AM","Nov 2, 2016 12:05:08 PM",3,NA,NA,NA,NA,1,NA,"Nov 2, 2016 11:35:00 AM","V411041",2,35,2,NA,NA,NA,NA,NA,NA,NA,1,2,"People selected me",2,"Farming",NA,2,1.5,NA,2,3,NA,NA,3,1,NA,2,"0",0,NA,NA,2,0,0,0,0,0,0,0,0,NA,NA,NA,2,NA,"I call her with the husband and listen to both sides first and then counsel them",10,2,1,1,NA,2,1,1,2,3,7,4,NA,"uuid:004d8553-ae86-41e5-ab43-bcc95aa07c98",1610200721,"uuid:004d8553-ae86-41e5-ab43-bcc95aa07c98",61
"78","Nov 3, 2016 7:37:36 PM","Nov 3, 2016 9:15:06 AM","Nov 3, 2016 9:43:22 AM",3,NA,NA,NA,NA,1,NA,"Nov 3, 2016 9:16:00 AM","V415221",2,49,1,NA,2,6,"I was selected by the LC1 committee",2,"Farming",NA,NA,NA,NA,NA,NA,NA,1,5,NA,1,30,500,NA,4,3,NA,0,"0",0,NA,NA,NA,NA,NA,NA,NA,NA,NA,NA,NA,NA,1,2,2,NA,"I go and talk to the husband",35,2,1,1,NA,1,2,1,1,3,NA,4,NA,"uuid:b870e000-acbf-40fd-9e74-56f2d2bebfa3",1610200721,"uuid:b870e000-acbf-40fd-9e74-56f2d2bebfa3",112
